ID-ES,TERM-ES,ID,TERME,Qualifier,DEFINITION INITIALE,DEFINITION FINALE,BIBLIOGRAPHIE,SYNONYMES,OBSERVATION,,,,,,,,,,,,,,
174,Droguete de seda ,174,Droguet,,"Étoffe (de laine et coton, coton et soie ou de soie) ornée de dessins brochés passant à l'envers d'un dessin à l'autre sans être tissés dans le fond de l'étoffe","Subst. masc. Le droguet est un façonné du XVIIIe siècle, à petit rapport de dessin produit par un effet de poil s'enlevant sur un fond armure quelconque. L'exécution exige deux corps de maillons : l'un pour la chaîne de fond qui passe ensuite dans des lisses ; l'autre pour la chaîne de poil. Les droguets liserés présentent généralement un décor par trames nuancées et effet de fin taffetas, se détachant sur des fonds à dominante de chaîne poil, normalement armurés en sergés ou dérivés. Ils comportent une chaîne poil et une chaîne pièce
","CIETA, Guelton, Marie-Hélène et Valansot, Odile (dir.). Vocabulaire technique français Lyon: Centre international d’étude des textiles anciens, 2020, p. 14 ; Pariset, Ernest. Les industries de la soie, sériciculture, filature, moulinage, tissage, teinture. Histoire et statistique, Lyon: Pitrat aîné, 1862, p. 298 ; Villard, Claude. Manuel de théorie du tissage. Tome II. Lyon: A. Rey, 1948, p. 191",,,,,,,,,,,,,,,,"174--Droguet--Subst. masc. Le droguet est un façonné du XVIIIe siècle, à petit rapport de dessin produit par un effet de poil s'enlevant sur un fond armure quelconque. L'exécution exige deux corps de maillons : l'un pour la chaîne de fond qui passe ensuite dans des lisses ; l'autre pour la chaîne de poil. Les droguets liserés présentent généralement un décor par trames nuancées et effet de fin taffetas, se détachant sur des fonds à dominante de chaîne poil, normalement armurés en sergés ou dérivés. Ils comportent une chaîne poil et une chaîne pièce
"
175,Efecto,175,Effet,,"Système de croisure participant à la formation d'un tissu façonné. Par extension, motif de dessin","Subst. masc. Système de croisure participant à la formation d'un tissu façonné (par exemple, ""effet chaîne"" ou ""trame""). Par extension, motif de dessin qu'il produit.","Baum, Maggy et Boyeldieu, Chantal. Dictionnaire encyclopédique des textiles. Paris: Eyrolles, 2018, p. 227 ; CIETA, Guelton, Marie-Hélène et Valansot, Odile (dir.). Vocabulaire technique français Lyon: Centre international d’étude des textiles anciens, 2020, p. 15, Villard, Claude. Manuel de théorie du tissage. Tome II. Lyon: A. Rey, 1948, p. 1-2",,,,,,,,,,,,,,,,"175--Effet--Subst. masc. Système de croisure participant à la formation d'un tissu façonné (par exemple, ""effet chaîne"" ou ""trame""). Par extension, motif de dessin qu'il produit."
176,Efecto de bastas por trama,176,Liseré,,Effet de dessin formé par une trame de fond,"Subst. masc. Part. pass. substantivé de lisérer, liserer. On donne le nom de liséré à un motif quelconque de décoration d'étoffe formé d'un effet de trame qui interrompt son travail d'armure pour constituer des flottés prévu par la mise en carte d'après le dessin choisi. On dit qu'un flotté de trame liséré repose sur une flotté de chaine d'envers.","CIETA, Guelton, Marie-Hélène et Valansot, Odile (dir.). Vocabulaire technique français Lyon: Centre international d’étude des textiles anciens, 2020, p. 29 ; Villard, Claude. Manuel de théorie du tissage. Tome II. Lyon: A. Rey, 1948, p.  59",Liséré,,,,,,,,,,,,,,,"220--Florence--Subst. masc. Ce tissu est un taffetas en compte léger, dans la réduction d'environ 30 à 40 fils au centimètre (chaine simple) ; la réduction en trame est à peu près la même. Il se trame à un ou deux bouts. Le Florence est la plus légère étoffe qui se fabrique en taffetas. On l'emploie ordinairement pour les doublures. Ce taffetas, qui se fabriquait à Lyon, était très mince et d'une médiocre qualité. On en faisait de toutes couleurs"
177,Efecto de perdido de urdimbre,177,Façonné à poil traînant,,,"Loc. masc. Comme pour les Mexicaines, les effets chaîne sont produits par plusieurs chaines supplémentaires et indépendantes de la chaîne de fond, produisant leur effet dessin à l'endroit du tissu, puis flottant derrière, entre les motifs. La composition d'un tissu à poil trainant comprend une chaîne de fond et une chaîne poil : ces deux chaînes sont distribuées dans une proposition qui peut être d'un pour un, ou deux pour un.","Maggy Baum et Chantal Boyeldieu, Dictionnaire encyclopédique des textiles, Paris : Eyrolles, 2018.",Poil traînant,,,,,,,,,,,,,,,"177--Façonné à poil traînant--Loc. masc. Comme pour les Mexicaines, les effets chaîne sont produits par plusieurs chaines supplémentaires et indépendantes de la chaîne de fond, produisant leur effet dessin à l'endroit du tissu, puis flottant derrière, entre les motifs. La composition d'un tissu à poil trainant comprend une chaîne de fond et une chaîne poil : ces deux chaînes sont distribuées dans une proposition qui peut être d'un pour un, ou deux pour un."
178,Efecto de perdido por trama ,178,Lancé,technique,,"Subst. masc. On donne le nom de lancé à un effet de trame produit par une ou plusieurs trames – du nom de lancé – qui sont supplémentaires ou indépendantes de la trame de fond. De ce fait, elles pourraient être supprimée sans que le tissu en souffre, seul son décor disparaitrait avec elles. Le tissu comprend donc une ou plusieurs chaînes suivant la composition du fond de l'étoffe, et il possède au moins deux trames, de nature ou de couleurs différentes : une trame de fond qui se combine avec la chaine pour former le tissu et la trame dite de lancé.","Baum, Maggy et Boyeldieu, Chantal. Dictionnaire encyclopédique des textiles. Paris: Eyrolles, 2018, p. 351 ; Hardouin-Fugier, Élisabeth, Berthod, Bernard, Chavent-Fusaro, Martine et Déprez, Camille. Les étoffes :  dictionnaire historique. Paris: l’Amateur (1994), 2005, p. 234 ; Lami, Eugène-Oscar. Dictionnaire encyclopédique et biographique de l'industrie et des arts industriels. Tome 1. Paris: Librairie Des Dictionnaires,1881, p. 51 ; Villard, Claude. Manuel de théorie du tissage. Tome II. Lyon: A. Rey, 1948, p. 62",Latté,,,,,,,,,,,,,,,"178--Lancé--Subst. masc. On donne le nom de lancé à un effet de trame produit par une ou plusieurs trames – du nom de lancé – qui sont supplémentaires ou indépendantes de la trame de fond. De ce fait, elles pourraient être supprimée sans que le tissu en souffre, seul son décor disparaitrait avec elles. Le tissu comprend donc une ou plusieurs chaînes suivant la composition du fond de l'étoffe, et il possède au moins deux trames, de nature ou de couleurs différentes : une trame de fond qui se combine avec la chaine pour former le tissu et la trame dite de lancé."
,,,,,,,,,,,,,,,,,,,,,,,----
180,Encaje ,180,Dentelle,,"Tissu sans trame ni chaîne, généralement en fil de soie, nylon ou fibres plus riches selon les cas, exécuté à la main ou à la machine, à l'aide de points semblables ou non formant un dessin, à bords dentelés ou non.","Subst. fém. Ext. de dentele, ancien diminutif de dent, au sens de ""petite dent"". Etoffe généralement en fils de soie ou de fils plus riches, dépourvue de trame et de chaîne, qui présente des jours, et à mailles très fines.","CNRTL. https://cnrtl.fr/definition/dentelle ; Dictionnaire de l'Académie française, https://www.dictionnaire-academie.fr/article/A9D1399",,,,,,,,,,,,,,,,"180--Dentelle--Subst. fém. Ext. de dentele, ancien diminutif de dent, au sens de ""petite dent"". Etoffe généralement en fils de soie ou de fils plus riches, dépourvue de trame et de chaîne, qui présente des jours, et à mailles très fines."
181,Encaje de aguja ,181,Dentelle à l'aiguille,,"La dentelle à l'aiguille est un ouvrage, où la dentellière forme elle-même le soutien (c'est-à-dire le ""réseau"" qu'elle va décorer) avec l'aiguille. La dentelle a fait ses débuts en Italie et a alors pris le nom de ""punto in aria"" (ou ""point dans l'air""), et on la retrouve pour la première fois mentionnée dans un ouvrage XVIème siècle. On pense que la dentelle à l'aiguille est née à Venise - tandis que la dentelle aux fuseaux serait née dans les Flandres. La dentelle à l'aiguille a été introduite en France par Catherine de Médicis.","Loc. fém. Exécutée à la main, la dentelle à l'aiguille désigne la technique qui consiste à former avec l'aiguille le réseau qui va ensuite être décoré (c'est le ""soutien""). Cette technique apparaît d'abord en Italie où elle est mentionnée pour la première fois au XVIe s. sous le nom de punto in aria (ou ""point dans l'air""). C'est Catherine de Médicis qui a introduit cette technique en France.",Leloir. Dictionnaire du costume ; Encyclopedia Britannica,,,,,,,,,,,,,,,,"181--Dentelle à l'aiguille--Loc. fém. Exécutée à la main, la dentelle à l'aiguille désigne la technique qui consiste à former avec l'aiguille le réseau qui va ensuite être décoré (c'est le ""soutien""). Cette technique apparaît d'abord en Italie où elle est mentionnée pour la première fois au XVIe s. sous le nom de punto in aria (ou ""point dans l'air""). C'est Catherine de Médicis qui a introduit cette technique en France."
,,,,,,,,,,,,,,,,,,,,,,,----
,,,,,,,,,,,,,,,,,,,,,,,----
,,,,,,,,,,,,,,,,,,,,,,,----
423,Envés,423,Envers,,Face du tissu opposée à l'endroit,"Subst. masc. Comp. de la prép. en et de vers. Désigne la face du tissu opposé à l'endroit, qui n'est généralement pas exposée à la vue.","CIETA. Vocabulaire français. Lyon: Centre  International d’Etude des Textiles Anciens, 1997 ; Dictionnaire de l'Académie française, https://www.dictionnaire-academie.fr/article/A9E2040",,,,,,,,,,,,,,,,"423--Envers--Subst. masc. Comp. de la prép. en et de vers. Désigne la face du tissu opposé à l'endroit, qui n'est généralement pas exposée à la vue."
424,Escalonado,424,Décochement,,"Succession des liages d'une armure, selon un rythme déterminé indiqué par un nombre.","Subst. masc. Dér. de décocher. préfixe, et le verbe hypothétique cocher ""pointer"". 
C'est le décalage de chaque point de liage par rapport à celui qui l'a précédé. Par exemple dans un satin de 5, avec interruption de 1, le décochement est de 2, parce que chaque point de liage saute un fil pour prendre le second, il y a décalage deux fils.Ce nombre est égal à 1 dans les sergés, car les liages se déplacent d'un seul fil à chaque passage de trame. Il est au minimum de 2 dans les satins réguliers. Il se compte de gauche à droite sur la face trame d'un satin, et de droite à gauche sur la face chaîne.
","« Centre National de Ressources Textuelles et Lexicales ». https://www.cnrtl.fr/definition/d%C3%A9cochement ; CIETA, Guelton, Marie-Hélène et Valansot, Odile (dir.). Vocabulaire technique français Lyon: Centre international d’étude des textiles anciens, 2020, p. 12 et 44 ; Lami Eugène-Oscar. Dictionnaire encyclopédique et biographique de l'industrie et des arts industriels. Tome 4. Paris: Librairie Des Dictionnaires,1884, p. 58 ; Pariset, Ernest. Les industries de la soie, sériciculture, filature, moulinage, tissage, teinture. Histoire et statistique, Lyon: Pitrat aîné, 1862, p. 169",,,,,,,,,,,,,,,,"424--Décochement--Subst. masc. Dér. de décocher. préfixe, et le verbe hypothétique cocher ""pointer"". 
C'est le décalage de chaque point de liage par rapport à celui qui l'a précédé. Par exemple dans un satin de 5, avec interruption de 1, le décochement est de 2, parce que chaque point de liage saute un fil pour prendre le second, il y a décalage deux fils.Ce nombre est égal à 1 dans les sergés, car les liages se déplacent d'un seul fil à chaque passage de trame. Il est au minimum de 2 dans les satins réguliers. Il se compte de gauche à droite sur la face trame d'un satin, et de droite à gauche sur la face chaîne.
"
185,Escarzo ,185,Bourre,,,"Subst. fém. De borre, ""partie la plus grossière de la laine"" (XIIe siècle). Du bas latin burra, ""étoffe grossière à longs poils"". On donne le nom de bourre à des fils plus courts, trop fins ou irréguliers, qu'on ôte de la soie grège pendant des opérations de filature ou de moulinage de la soie et même de tissage. C'est un ""déchet de soie"" traité en filature de schappe. 
","Académie française. « Dictionnaire de l’Académie française », https://www.dictionnaire-academie.fr/article/A9B1846 ; Clavairolle, Françoise. Sériciculture en Cévennes, Essai d'anthropologie historique et sociale sur la dynamique des savoirs et de la production. Thèse d'ethnologie. Paris: EHESS, 1997, p. 533 ; Pariset, Ernest. Les industries de la soie, sériciculture, filature, moulinage, tissage, teinture. Histoire et statistique, Lyon: Pitrat aîné, 1862, p. 129 ; Péguy, Charles-Pierre. ""L'industrie françaises des déchets de soie"". In: Revue de géographie alpine, tome 32, n°2, 1944. p. 307-314; doi : https://doi.org/10.3406/rga.1944.4794https://www.persee.fr/doc/rga_0035-1121_1944_num_32_2_4794 ; VIEIL, Pierre. Sériciculture. Paris: J.-B. Baillière et fils, 1920, p. 105, p. 105",,,,,,,,,,,,,,,,"185--Bourre--Subst. fém. De borre, ""partie la plus grossière de la laine"" (XIIe siècle). Du bas latin burra, ""étoffe grossière à longs poils"". On donne le nom de bourre à des fils plus courts, trop fins ou irréguliers, qu'on ôte de la soie grège pendant des opérations de filature ou de moulinage de la soie et même de tissage. C'est un ""déchet de soie"" traité en filature de schappe. 
"
,,,,,,,,,,,,,,,,,,,,,,,----
,,,,,,,,,,,,,,,,,,,,,,,"234--Gaze à tour anglais--Loc. fém. Pour produire ce tissu léger à fils sinueux, la chaîne est divisée en deux parties : 1. Les fils de droits, 2.  Les fils de tours qui se déplacent pour contourner les fils droits et sont fixés par la trame d'un côté et de l'autre de ces derniers. Le tissu ainsi produit est généralement, mais pas nécessairement ajouré. Les armures gaze varient presque à l'infini, en fonction du nombre de fils droits et de fils de tours. Ce procédé a été mis au point par un tisseur anglais - d'où le nom de ce tissu."
188,Esparragón ,188,Esparragon,,Subst. masc. Sorte d'étoffe de soie,Subst. masc. Terme esp. sans équivalent en français désignant un cordon de soie.,"Melchior Emmanuel Núñez de Taboada, Dictionnaire espagnol-français, dixième édition, P.-J. Rey, 1847, Tome second ; J.-L. Barthélemi, Dictionnaire portatif et de pronunciation espagnol-français et français-espagnol a l'usage des deux nations..., Lyon, Chez B. Cormon et Blanc, 1803.",,,,,,,,,,,,,,,,188--Esparragon--Subst. masc. Terme esp. sans équivalent en français désignant un cordon de soie.
189,Espiguilla,189,Chevron,armure,Sillon oblique avec retour par effet de chaîne ou de trame,"Subst. masc. dérivé de du lat. capra, ""chèvre"", et dit pour ""solive"". Les chevrons sont des armures dérivés des sergés qui présentent des côtes de sergé brisées à une plus ou moins grande longueur, dont la direction symétrique fournit une succession d'angles qui prennent le nom de chevrons. Il en existe deux genres :  les chevrons dans le sens de la chaîne et les chevrons dans le sens de la trame.","Académie française. « Dictionnaire de l’Académie française », https://www.dictionnaire-academie.fr/article/A9C1962 ; Baum, Maggy et Boyeldieu, Chantal. Dictionnaire encyclopédique des textiles. Paris: Eyrolles, 2018, p. 126 ; Bezon, Jean. Dictionnaire général des tissus anciens et modernes.‎ Tome 1.‎ Lyon : Th . Lepagnez, 1859, p. 137 et sg. ; Villard, Claude. Manuel de théorie du tissage. Tome I. Lyon: A. Rey, 1948,p. 156-161",,,,,,,,,,,,,,,,"189--Chevron--Subst. masc. dérivé de du lat. capra, ""chèvre"", et dit pour ""solive"". Les chevrons sont des armures dérivés des sergés qui présentent des côtes de sergé brisées à une plus ou moins grande longueur, dont la direction symétrique fournit une succession d'angles qui prennent le nom de chevrons. Il en existe deux genres :  les chevrons dans le sens de la chaîne et les chevrons dans le sens de la trame."
190,EspolÍn ,190,Espolin,objet,Petite navette utilisée pour le tissage des trames brochées,Subst. masc. Petite navette qui contient la soie utilisé pour le tissage des trames brochées.,"CIETA. Vocabulaire français. Lyon: Centre  International d’Etude des Textiles Anciens, 1997 ; Encyclopédie ou Dictionnaire raisonné des sciences, des arts et des métiers, par une Société de Gens de lettres, https://artflsrv03.uchicago.edu/philologic4/encyclopedie1117/navigate/5/3459/?byte=10271479",,,,,,,,,,,,,,,,190--Espolin--Subst. masc. Petite navette qui contient la soie utilisé pour le tissage des trames brochées.
191,Espolín ,191,Espolin,tissu,,Subst. masc. Terme esp. très utilisé pour désigner les tissus de soie brochés dans certaines régions d'Espagne.,"Melchior Emmanuel Núñez de Taboada, Dictionnaire espagnol-français, dixième édition, P.-J. Rey, 1847, Tome second ; J.-L. Barthélemi, Dictionnaire portatif et de pronunciation espagnol-français et français-espagnol a l'usage des deux nations..., Lyon, Chez B. Cormon et Blanc, 1803.",,,,,,,,,,,,,,,,191--Espolin--Subst. masc. Terme esp. très utilisé pour désigner les tissus de soie brochés dans certaines régions d'Espagne.
192,Espolinado,192,Broché,,,"Loc. masc. 1. On désigne sous le nom de broché un effet de décor produit par une ou plusieurs trames supplémentaires au tissu ayant, comme caractère distinctif, que chaque motif dans la largeur de l'étoffe a ses trames indépendantes arrêtées à l'envers aux contours extérieurs du dessin. Ces effets sont généralement très apparents à l'étoffe par le fait d'une tramure beaucoup plus grosse que la trame de fond. 2. Tissu auquel participent de telles trames.","CIETA, Guelton, Marie-Hélène et Valansot, Odile (dir.). Vocabulaire technique français Lyon: Centre international d’étude des textiles anciens, 2020, p. 4 ; Hardouin-Fugier, Élisabeth, Berthod, Bernard, Chavent-Fusaro, Martine et Déprez, Camille. Les étoffes :  dictionnaire historique. Paris: l’Amateur (1994), 2005, p. 109 ; Villard, Claude. Manuel de théorie du tissage. Tome II. Lyon: A. Rey, 1948, p. 71",Espoliné,,,,,,,,,,,,,,,"192--Broché--Loc. masc. 1. On désigne sous le nom de broché un effet de décor produit par une ou plusieurs trames supplémentaires au tissu ayant, comme caractère distinctif, que chaque motif dans la largeur de l'étoffe a ses trames indépendantes arrêtées à l'envers aux contours extérieurs du dessin. Ces effets sont généralement très apparents à l'étoffe par le fait d'une tramure beaucoup plus grosse que la trame de fond. 2. Tissu auquel participent de telles trames."
,,,,,, ,,,,,,,,,,,,,,,,,---- 
194,Espumilla ,194,Crêpe chiffon,,,"Loc. masc. Etoffe à armure toile, légère et transparente, avec une chaîne et une trame en soie grège","Melchior Emmanuel Núñez de Taboada, Dictionnaire espagnol-français, dixième édition, P.-J. Rey, 1847, Tome second ; J.-L. Barthélemi, Dictionnaire portatif et de pronunciation espagnol-français et français-espagnol a l'usage des deux nations..., Lyon, Chez B. Cormon et Blanc, 1803 ; Elisabeth Hardouin-Fugier et al., Les étoffes : dictionnaire historique, Paris : Les éditions de l'Amateur, 2005 ; Jean-Jacques Boucher, Le dictionnaire de la soie : découvrir son histoire de ses origines jusqu'à nos jours, Paris, F. Lanore, 2015.",,,,,,,,,,,,,,,,"194--Crêpe chiffon--Loc. masc. Etoffe à armure toile, légère et transparente, avec une chaîne et une trame en soie grège"
195,Espumillón ,195,Crépon,tissu,,"Subst. masc. Dér. de l’anc. fr. cresp, crespe. Taffetas tissé à Lyon avec une trame de coton ondé ayant subi une torsion importante, sur une chaine de soie dont la torsion des fils est normale, et qui a subi un apprêt final. En 1722, on trouve un crépon en laine et soie à chaîne torse produit à Amiens. ","Baum, Maggy et Boyeldieu, Chantal. Dictionnaire encyclopédique des textiles. 1 vol. Paris: Eyrolles, 2018, p. 178 ; Bezon, Jean. Dictionnaire général des tissus anciens et modernes.‎ Tome 1. ‎ Lyon : Th . Lepagnez, 1859, p.  70 ; Boucher, Jean-Jacques. Le dictionnaire de la soie: découvrir son histoire de ses origines jusqu’à nos jours. Paris: F. Lanore, 2015, p. 166 ; Hardouin-Fugier, Élisabeth, Berthod, Bernard, Chavent-Fusaro, Martine et Déprez, Camille. Les étoffes :  dictionnaire historique. Paris: l’Amateur, 1994, p. 155.",,,,,,,,,,,,,,,,"195--Crépon--Subst. masc. Dér. de l’anc. fr. cresp, crespe. Taffetas tissé à Lyon avec une trame de coton ondé ayant subi une torsion importante, sur une chaine de soie dont la torsion des fils est normale, et qui a subi un apprêt final. En 1722, on trouve un crépon en laine et soie à chaîne torse produit à Amiens. "
196,Estampado ,196,Imprimé,attribut,,Adj. Part. passé d'imprimer. Qualifie des tissus dont le décor a été obtenu par un procédé d'impression.,"Melchior Emmanuel Núñez de Taboada, Dictionnaire espagnol-français, dixième édition, P.-J. Rey, 1847, Tome second ; CNRTL, https://cnrtl.fr/definition/imprim%C3%A9",,,,,,,,,,,,,,,,196--Imprimé--Adj. Part. passé d'imprimer. Qualifie des tissus dont le décor a été obtenu par un procédé d'impression.
197,Estampado ,197,Imprimé,tissu,,Subst. masc. Part. passé subst. d’imprimer. Terme générique désignant les tissus dont les motifs ont été appliqués sur l'étoffe par impression.,"Melchior Emmanuel Núñez de Taboada, Dictionnaire espagnol-français, dixième édition, P.-J. Rey, 1847, Tome second ;  Jean-Jacques Boucher, Le dictionnaire de la soie : découvrir son histoire de ses origines jusqu'à nos jours, Paris, F. Lanore, 2015 ; CNRTL, https://cnrtl.fr/definition/imprim%C3%A9 ; Dictionnaire de l'Académie française, https://www.dictionnaire-academie.fr/article/A9I0476",,,,,,,,,,,,,,,,197--Imprimé--Subst. masc. Part. passé subst. d’imprimer. Terme générique désignant les tissus dont les motifs ont été appliqués sur l'étoffe par impression.
198,Estampar ,198,Imprimer,,,"Vb. trans. Empr. du lat. imprimere ""appuyer sur"", dér. de premere ""presser"". Action qui décrit les divers procédés utilisés pour imposer sur le tissu des décors colorés dans la phase dite d'achèvement. Pour les tissus de soie, l'impression est effectuée une fois les pré-traitements réalisés (l'étoffe est alors dépourvue de corps gras et d'acide), et les motifs sont fixés à la vapeur.","Elisabeth Hardouin-Fugier et al., Les étoffes : dictionnaire historique, Paris : Les éditions de l'Amateur, 2005 ; Jean-Jacques Boucher, Le dictionnaire de la soie : découvrir son histoire de ses origines jusqu'à nos jours, Paris, F. Lanore, 2015.",,,,,,,,,,,,,,,,"198--Imprimer--Vb. trans. Empr. du lat. imprimere ""appuyer sur"", dér. de premere ""presser"". Action qui décrit les divers procédés utilisés pour imposer sur le tissu des décors colorés dans la phase dite d'achèvement. Pour les tissus de soie, l'impression est effectuée une fois les pré-traitements réalisés (l'étoffe est alors dépourvue de corps gras et d'acide), et les motifs sont fixés à la vapeur."
199,Estofar ,199,Piquer,,Broder en relief,"Loc masc. Dans les matelassés unis, la pièce d'endroit travaille avec tous les coups de fond en sergé ou en satin. la pièce d'envers travaille toujours en taffetas avec les coups de ""piqué"". Entre ces deux tissus passe la trame ""de bourré"" pour donner l'épaisseur. La piqûre qui constitue le genre matelassé est produite par le passage des fils de la pièce d'endroit sur les coups de la pièce d'envers, coups de ""piqué"", en suivant le dessin préparé à cet effet sur la mise en carte. Effet très apprécié au XVIIIe siècle, en particulier en Provence.","Boucher, Jean-Jacques. Le dictionnaire de la soie: découvrir son histoire de ses origines jusqu’à nos jours. Paris: F. Lanore, 2015, p. 474 ; Hardouin-Fugier, Élisabeth, Berthod, Bernard, Chavent-Fusaro, Martine et Déprez, Camille. Les étoffes :  dictionnaire historique. Paris: l’Amateur (1994), 2005, p. 307 ;  Villard, Claude. Manuel de théorie du tissage. Tome II. Lyon: A. Rey, 1948, p. 185-186",,,,,,,,,,,,,,,,"199--Piquer--Loc masc. Dans les matelassés unis, la pièce d'endroit travaille avec tous les coups de fond en sergé ou en satin. la pièce d'envers travaille toujours en taffetas avec les coups de ""piqué"". Entre ces deux tissus passe la trame ""de bourré"" pour donner l'épaisseur. La piqûre qui constitue le genre matelassé est produite par le passage des fils de la pièce d'endroit sur les coups de la pièce d'envers, coups de ""piqué"", en suivant le dessin préparé à cet effet sur la mise en carte. Effet très apprécié au XVIIIe siècle, en particulier en Provence."
,,,,,,,,,,,,,,,,,,,,,,,----
