ID-ES,TERM-ES,ID,TERME,Qualifier,DEFINITION INITIALE,DEFINITION FINALE,BIBLIOGRAPHIE,SYNONYMES,OBSERVATION,,,,,,,,,,,,,,
675,Estilo imperio,675,Style Empire,,,"Loc. masc. Par méton., empr. du latin imperium ""pouvoir suprême, empire"", de imperare ""commander"". Le style Empire débute en 1800 et se termine en 1815 et accompagne le règne de Napoléon Ier. L'Empereur va ainsi utiliser ce style comme un moyen de glorifier son pouvoir, en utilisant à son profit les motifs décoratifs empruntés de la Rome antique. Le style Empire va ainsi puiser dans la pompe et le pouvoir impérial antique, en reprenant les éléments basiques du néoclacissisme et en magnifiant à la fois leur échelle et leur ornementation. Les intérieurs proposent du mobilier imposant et utilisent des couleurs vives, comme le bleu profond, le vert, le rouge, le jaune doré et le violet. Les ornements s'inspirent de l'Antiquité : palmettes, fleurs de lotus, rinceaux... ; et ils invoquent aussi un bestiaire mythologique : sphinges ailés, chimères, griffons... L'industrie soyeuse est en crise depuis la Révolution, mais les commandes passées en 1802 par Camille Pernon pour le château de Saint-Cloud revitalise la production : brocart argent et or fond gros de Tours pour le grand salon de Joséphine, brocart or fond ponceau, talon fond gros bleu pour sa chambre. Un brocart or et cramoisi à feuilles de chêne et de laurier avec aigle est commandé pour la salle du trône. Grand Frères réalise entre 1811 et 1813 un damas carrelé bleu à fleurs indigo pour l'appartement de l'Empereur. L'invention du métier Jacquard fait également beaucoup pour le développement des soieries lyonnaises, qui connaissent un renouveau sous le patronnage napoléonien. Les motifs de ces soieries sont influencés par Percier : dessins géométriques à compartiment, feuillages et végétaux (myrte, vigne), sans oublier les motifs symbolisant le règne : rosaces, abeilles, couronnes, médaillons, bouquets de fleurs. On utilise des couleurs vives grâce à de nouveaux pigments qui permettent de créer de nouvelles teintes comme le bleu profond employé pour le damas des cabinets de toilettes des appartements du couple impérial à Versailles. Peu de tapis sont commandés sous l'Empire, qui préfère se contenter de l'existant, même si la Savonnerie de Chaillot continue à produire des pièces de couleurs vives. La production de tapisseries décroît considérablement, car on n'utilise plus (et cela pour une cinquantaine d'années) ces pièces pour décorer les intérieurs. Sont produites toutefois des tapisseries dépeignant des scènes historiques, et glorifiant Napoléon Ier comme ces tableaux en tapisserie de l'Empereur. Dans le costume, le velours détrône le linon et la mousseline, résultat des efforts pour redynamiser l'industrie lyonnaise. Les couleurs en vogue sont : le noir, le ponceau, l'amarante, le souci, le gros vert. En été, on utilise la perkale, de couleur blanche ou dans des teintes claires.","Judith Gura, The Guide to period styles for interiors. From the 17th Century to the Present, New York : Bloomsbury, 2016 ; Jean-François Barrielle et al., Les styles français, Paris : Flammarion, 1998 ; François Boucher, Histoire du costume en Occident, Paris : Flammarion, 1996 ; Christophe Huchet de Quénetain, Les styles Consulat & Empire, Paris : Les éditions de l'Amateur, 2006.        ",,,,,,,,,,,,,,,,
676,Estilo chinoiserie,676,Chinoiserie,,"Représentation de scènes chinoises, notamment de mariage. Elle est combinée parfois avec des singeries.","Subst. fém. Dér. de chinois. Avec l'importation de porcelaines chinoises par la Compagnie française des Indes orientales et les récits de voyage d'explorateurs comme Jean-Baptiste Tavernier, se développe en France dans le dernier quart du XVIIe s. la mode de l'exotisme oriental, qui s'exprime à travers le goût immodéré pour les ""chinoiseries"". La France est alors très friande de tissus importés de Chine. Ce goût ne s'éteint pas au XVIIIe s. et on voit de plus en plus se développer le style des chinoiseries, qui est perçu comme un art de la fantaisie, et qui se développe à travers une hybridité artistique s'exprimant par des incohérences stylistiques et compositionnelles, défiant les règles de la raison et du classicisme. Les chinoiseries ont connu leur heure de gloire avec le style rococo. Le répertoire chinois a ainsi largement nourri l'imaginaire stylistique et artistique du charmant et du plaisant propre à ce style. De nombreuses créations dans le goût chinois vont aussi s'intégrer dans le style Louis XV. Les chinoiseries sont en effet des créations purement occidentales, même si elles peuvent s'inspirer de sources orientales. Après l'interdiction de l'importation des tissus d'origine chinoise pour protéger l'industrie nationale, va alors se développer la production de tissus chinoisants, confectionnés à Lyon. A la fin du XVIIe s., on lance des tissus avec des motis semi-abstraits, d'inspiration chinoise, mêlés à des fleurs et des animaux fantaisistes, tout cela dans des compositions asymétriques relevées de couleurs vives et rehaussées de brochés d'or et d'argent. Ce sont les soies ""bizarres"", qui ont du succès jusque dans les années 1725. La chinoiserie sur tissu se tourne alors vers les fleurs des Indes et les motifs moins abstraits influencés par les panneaux de laque importés de Chine et du Japon. Jean Revel à Lyon et Antoine Fraisse à Paris développent ainsi des motifs de fleurs, entremêlés de parasols, de personnages et de motifs architecturaux. De grands artistes comme François Boucher donnent un second souffle à la chinoiserie ; Jean Pillement, peintre et aquafortiste lyonnais (1728-1808) va aussi beaucoup influencer la création textile européenne jusqu'à la fin du XVIIIe s. Les tisserands et lissiers sont ainsi influencés par les artistes, et confectionnent des étoffes dans le style ""chinoiserie"", à la fois pour l'habillement et pour l'ameublement. ","Bernard Wodon, L'ornement de l'Antiquité au XXe s., Paris : Citadelles & Mazenod, 2014 ; Vanessa Alayrac-Fielding (dir.), Rêver la Chine, Tourcoing : Editions invenit, 2017 ; Alain Gruber, Chinoiserie. L'influence de la Chine sur les arts en Europe XVIIe -XIXe s., Bern : Abegg-Stiftung Bern in Riggisberg, 1984 ; Dictionnaire de l'Académie française, https://www.dictionnaire-academie.fr/article/A9R2958.",,,,,,,,,,,,,,,,
677,Estilo Luis XV,677,Style Louis XV,,,"Loc. masc. Le style Louis XV connaît trois grandes phases : une phase de préparation avec le style Régence ou style Rococo (1715-1730), une phase d'épanouissement du style rocaille, ou le style Louis XV proprement dit (1730-1750), et une phase de réaction ou style Transition (1750-1774) qui passe par l'épuration des formes rocaille et une imitation des formes antiques. Il ne s'agit plus d'un style officiel (contrairement au style Louis XIV), mais d'un style qui est le fait d'artistes servant une clientèle privée qui souhaite confort, intimité et agrément. Dans l'architecture intérieure, on favorise ainsi des pièces plus petites (boudoirs, petits salons, cabinets). Les arts décoratifs montrent des formes plus légères et discrètes, très raffinées. Le style Louis XV débute avec le style rocaille, art du contraste et de la surprise. Les ornements de cette période priviliégie l'abondance, la courbe et l'asymétrie. Le rocaille se ""symétrise"" dans les années 1740 et atteint sa pleine maturité dans les années 1751-1753. Les motifs décoratifs, fleurs, feuilles d'eau, coquilles, dragons, roseaux palmiers, sont alors disposés plus symétriquement. C'est le plus pur style Louis XV, avec sa nuance, son équilibre et son élégance. Une forme de réaction au style rocaille apparaît dans les années 1753 à 1760, avec l'introduction d'éléments plus classiques : on lui donne alors l'épithète de ""rocaille symétrisé classicisant"". Progressivement, on va glisser dans une phase de transition, qui annonce le style Louis XVI et marque le déclin du style Louis XV. Ce style combine alors de manière harmonieuses élements rocaille et éléments classiques. Le style Louis XV voit évoluer le répertoire des motifs. On passe de la fleur décorative et symbolique comme le lis ou le tournesol, à la fleur au naturel comme la rose, la petite fleur des champs, la primevère, l'oeillet. On retrouve également le palmier et la feuille d'acanthe. L'arabesque envahit le textile, dans les bordures de tapisserie, les encadrements, les garnitures des sièges. La coquille est également un motif très à la mode. Se manifeste aussi un certain goût pour le ""bizarre"" avec l'utilisation du bestiaire fantastique, permettant de produire des formes zooomorphes fantastiques. Les thèmes de la fable sont aussi à la mode, tout comme le thème de la pastorale - surtout la pastorale galante. Les thèmes exotiques sont également très appréciés, et s'expriment à travers la chinoiserie. Les tissus vont envahir les appartements, avec des couleurs gaies, vives et fraîches. Les commandes royales sont nombreuses, notamment aux manufactures de Lyon et de Tours pour la soie. Des nouveautés techniques cherchent d'ailleurs à améliorer la production des soieries. En 1733, Jean Revel invente la technique dite des points rentrés qui, par l'interpénétration des fils de trame, permet d'obtenir des effets de modèles naturalistes. En 1747, le premier métier automatique pour les étoffes unies, bientôt adapté aux étoffes brochées, est mis au point par Vaucanson. Mais l'invention se trouve surtout dans le décor des étoffes : un traitement plus naturaliste, et une décoration qui suit la mode de la pastorale et de la chinoiserie, remplacent les grandes compositions symétriques et opulentes du siècle précédent. Les meubles se garnissent de lampas, brocarts, taffetas, gros de tours, satins. Mais la concurrence des tissus imprimés est forte, à tel point qu'on les interdit à l'importation. Les indiennes sont en effet très appréciées : on raffole du ""chitte"" puis ""chintz"", importé par la Compagnie des Indes. Dans le costume, la Fabrique lyonnaise développe au début du règne de Louis XV un style charnu et naturaliste pour le décor des soieries ; ensuite ce sera une ornementation plus légère, avec des ornements floraux qui s'allient à des rubans imitant la dentelle. De nouveaux modèles d'ornementation assure également le succès de la Fabrique lyonnaise. Jean Pillement, auteur des Fleurs idéales, est le créateur de stylisations florales et de chinoiseries. La broderie connaît aussi son heure de gloire, sur les taffetas, satins, velours, et mêle la soie à l'or et à l'argent. ","François Boucher, Histoire du costume en Occident, Paris : Flammarion, 1996 ; Sophie Mouquin, Le style Louis XV, Paris : Les Editions de l'Amateur, 2004 ; Jean-François Barrielle et al., Les styles français, Paris : Flammarion, 1998.",,,,,,,,,,,,,,,,
678,Estilo Luis XVI,678,Style Louis XVI,,,"Loc. masc. C'est vingt-cinq ans avant le couronnement de Louis XVI que se font sentir les prémices du style qui portera son nom. Ce style est inauguré en 1771 par Louis XV avec l'ouverture du pavillon de Louveciennes. Le style Louis XVI s'épanouit ensuite entre 1770-1778 où il est ""triomphant"", puis jusqu'en 1785 où il ""fleurit"" sous l'influence de Marie-Antoinette. Ce mouvement s'inscrit dans le style néoclassique, et puise ses origines dans l'art antique. Il rejette le style rocailleux de la période précédente, et remet au goût du jour des formes rectilignes et rigoureuses, inspirées notamment des découvertes archéologiques des sites antiques de Pompéi et Herculanum. Durant cette période, les tapisseries très coûteuses passent de mode, et on voit un certain ralentissement des manufactures royales des Gobelins et d'Aubusson. Si les tapisseries sont encore utilisées dans les pièces d'apparat des demeures royales, on les remplace par des matières solides et peu chères dans les pièces secondaires et les antichambres. Les tissus en soie pure, ou soie mélangée pour diminuer les coûts, décorent les appartement de société et pièces principales privées. L'étoffe la plus utilisée est le damas : surtout pour les meubles d'hiver, avec des soies plus lourdes comme le gros de Tours. Pour les meubles d'été, on préfère les tissus plus légers mais plus fragiles comme le taffetas. Les tissus, notamment les soieries, deviennent plus lumineux, plus gais. Le décor s'allège et se miniaturise par rapport à la période précédente. Apparaît également le motif des rayures qui flatte la silhouette féminine. Parmi les étoffes légères les plus appréciées, on retrouve le taffetas, mais aussi le pékin, tissu de soie peinte. Le rouge cramoisi, pour le velours et le damas, envahit les pièces d'apparat. A partir des années 1770, on lui préfère le bleu et le blanc ; à partir de 1785, c'est le vert anglais qui domine. Toutefois, dans toute la deuxième moitié du XVIIIe s., les soies blanches, en taffetas ou en satin, à motifs polychromes, peints, chinés, brochés, surbrodés, sont très appréciées par une clientèle d'exception. Le commerce de la soie atteint son apogée, notamment grâce à la Fabrique lyonnaise. Ces étoffes présentent un décor construit sur des lignes plus rigides que la période précédente. Elles sont destinées à accompagner les meubles qui perdent alors leurs formes bombées et gagnent en sobriété. De nombreuses références à l'Antiquité ornent ces dernières : on les retrouve par exemple sur les compositions des tentures à fond bleu pâle, vert d'eau et rouge-cerise, où se déploient des guirlandes fleuries et des cordons de perles. Les motifs en vogue sont les motifs à treillage, les motifs à médaillons ou les arabesques, et les motifs floraux. La production du XVIIIe s. est dominée par les grands maîtres décorateurs comme Delafosse, Salembier ou Bellanger. C'est aussi durant cette période que l'on invente le tissu ""chiné à la branche"". La production de la Fabrique Lyonnaise arrive alors à son apogée, notamment avec l'oeuvre de Philippe de Lasalle. Les soieries offrent une grande variété de textures et de décors. La broderie est aussi particulièrement appréciée ; et comme durant le style Louis XV, elle se marrie à la soie, l'or et l'argent, mais aussi aux paillettes et à la chenille, s'inscruste avec de la dentelle.","Anne Droguet, Les styles. Transition et Louis XVI, Paris : Les Editions de l'Amateur, 2004 ; Henri d'Hennezel, Pour comprendre les tissus d'art, Paris : Librairie Hachette, 1930 ; François Boucher, Histoire du costume en Occident, Paris : Flammarion, 1996.",,,,,,,,,,,,,,,,
679,Estilo jardinière,679,Style jardinière,,,"Loc. masc. Dér. de jardin. Le style jardinière qualifie des soieries aux couleurs vives produites au XVIIe s., et dont la caratéristique principale est d'être couvertes de nombreuses fleurs. Ces étoffes ont été utilisées pour des robes et des tentures. Les soies brochées étaient utilisées pour confectionner des robes, tandis que les velours étaient utilisés pour l'ameublement - décoration des murs ou garniture des fauteuils. Ces soieries étaient confectionnées à Lyon.","Dictionnaire de l'Académie française, https://www.dictionnaire-academie.fr/article/A9J0111 ; Dupont-Auberville, M. L’ornement des tissus : recueil historique et pratique. Paris: Libr. générale de l’Architecture et des travaux publics Ducher et Cie., 1877","Style à parterres, Soierie multiflore dite jardinière",,,,,,,,,,,,,,,
680,Estilo isabelino,680,Style élisabéthain,,,"Loc. masc. Empr. de l’ang. elizabethan, dérivé du nom de la reine Elisabeth Ière. Ce style fait référence à l'architecture et aux arts décoratifs qui ont prospéré durant le règne de la reine Elisabeth Ière d'Angleterre (1558-1603). Durant son long règne, l'architecture et la décoration sont entrés dans une phase nouvelle. On y remarque l'influence flamande ainsi que celle de l'Orient. L'architecture est clairement marquée par la prospérité du pays. Une tendance à la symétrie caractérise les plans, et les batisseurs mettent l'accent sur un éclairage abondant, permis par de hautes verrières qui barrent les façades. On remarque également l'influence flamande avec des pignons en forme de ""S"". A l'intérieur, les murs sont en général couverts de boiseries de chêne divisées en compartiments géométriques. On retrouve l'influence orientale dans les incrustations de ces boiseries. Le mobilier est peu influencé par la Renaissance, et on remarque le caractère simple des meubles anglais. Du côté de l'art textile, le costume sous le règne d'Elisabeth Ière est très luxueux et très orné. Avec l'invention des aiguilles d'acier et l'importation accrue de soies de couleur se développe la broderie élisabéthaine. Les broderies anglaises étaient déjà renommées au Moyen-Âge, mais elles prennent alors un essor nouveau. On y mêle la soie à des fils de métal. Les motifs de fleurs stylisées sont parfois mélangées à de petits animaux, et disposés dans des enroulements de rinceaux.","André Devèche, Les styles anglais, Paris : Flammarion, 1988 ; François Boucher, Histoire du costume en Occident, Paris : Flammarion, 1996",,,,,,,,,,,,,,,,
681,Estilo renacentista,681,Style Renaissance,,,"Loc. masc. Dér. de renaître, sur le mod. de naissance. Les expéditions d'Italie de Charles VII, Louis XII et François Ier ont suscité un engouement pour l'art italien chez ces princes. Les premières manifestations de la Renaissance en France apparaissent alors avec un goût pour l'italianisme au début du XVIe s. L'un des premiers exemples de cette influence italienne est le château de Gaillon dans l'Eure. Mais c'est surtout avec François Ier que débute la Renaissance en France. On voit ainsi apparaître un style ornemental ""à l'antique"", sans véritable rapport avec les recherches esthéthiques italiennes, mais qui perdurera jusque vers 1535-1540. Les expérimentations menées à la cour de François Ier à Fontainebleau permettent d'élaborer un art de cour, grâce aux travaux menés par des artistes italiens comme le Rosso et le Primatice, appelés par le Roi : c'est l'école de Fontainebleau. Cette première Renaissance se développe ainsi de 1527 à 1540. De 1540 à 1560, on se tourne vers un classicisme plus épuré, favorisé par une meilleure connaisance de l'antique. Peu à peu, les artistes français, formés parfois à Rome, développent leur propre style : le couronnement d'Henri II et son arrivée à Paris marquent leur avénement. La Renaissance se poursuit en France jusqu'en 1589 et la fin de la dynastie des Valois qui a mené à bien de grands projets architecturaux. Toutefois, Henri IV poursuit un certain nombre de ces projets après 1589, et certains traits propres au style Renaissance sont perceptibles jusqu'en 1630-1640. Concernant l'art textile, des ateliers itinérants produisent au début du XVIe s. dans la vallée de la Loire des tapisseries à ""mille fleurs"". Les sujets représentés sont profanes : concerts, bergeries, scènes de la vie seigneuriale. Les productions françaises restent médiévales ; c'est pourquoi François Ier commande des pièces à Bruxelles ou Anvers qui confectionnent des tapisseries copiées sur les grands maîtres comme Raphaël. Un atelier de haute lice est créé à la fin du règne de François Ier ; il produit les Danaé pour la galerie François Ier à Fontainebleau, ou encore Histoire de saint Mammès pour le choeur de la cathédrale de Langres. Les ateliers de la Trinité sont fondés à Paris par Henri II en 1551 et produisent des tapisseries à décors de grotesques, motif apparu en France avec la voûte de la galerie d'Ulysse à Fontainebleau, et largement diffusé par Du Cerceau dans son Livre de grotesques. Bien que tardive, la tenture de l'Histoire d'Artémise (vers 1610) montre une évolution du style dans le décor des bordures, qui de quasi inexistantes deviennent larges, ornées de rinceaux ou de guirlandes avec des cartouches présentées par des putti et des personnages dans les angles. Dans le costume, on est influencé par l'idéalisation du corps humain propre à la Renaissance. On utilise alors des matériaux luxueux, des étoffes riches et lourdes, des broderies d'or et d'argent et des dentelles aériennes. Par exemple, la garde-robe de Charles VII comporte du taffetas noir, du satin noir, tanné, violet et cramoisi, du damas gris et noir, ou encore du velours noir.","Dictionnaire de l'Académie française, https://www.dictionnaire-academie.fr/article/A9R1663 ; Jean-François Barrielle et al., Les styles français, Paris : Flammarion, 1998 ; Bernard Wodon, L'ornement de l'Antiquité au XXe s., Paris : Citadelles & Mazenod, 2014 ; François Boucher, Histoire du costume en Occident, Paris : Flammarion, 1996 ; Denis Bruna et Chloé Demey (dir.); Histoire des modes et du vêtement du Moyen Âge au XXIe s., Paris : Les Editions Textuels, 2018.",,,,,,,,,,,,,,,,
682,Estilo barroco,682,Style baroque,,,"Loc. masc. Du port. barroco, ""perle irrégulière"". La période baroque débute aux alentours de 1580 et se termine vers 1750 en Europe. Le baroque est particulièrement florissant en France, en Italie et en Espagne, et il est une continuation flamboyante du style Renaissance. Le baroque français s'est développé sous le règne de Louis XIV (1643-1715). Ce style était très apprécié par le roi lui-même, qui l'utilisait pour mettre en valeur son pouvoir et sa vision de la royauté. On considère que le baroque a fleuri en France entre 1643 et 1730, mais ce n'est vraiment qu'à partir de 1660 que la version française de ce style se développe. Le plus bel exemple de ce dernier est incarné par le Château de Versailles. Le déclin du baroque est marqué par sa progressive transition vers le style rococo, plus féminin. Les textiles de la période baroque sont particulièrement fastueux, et présentent de larges motifs. En 1662, Louis XIV fait l'acquisition de l'Hôtel des Gobelins, sous l'impulsion de Jean-Baptiste Colbert (1619-1683), qui en fait la Manufacture royale des Gobelins, pour produire des tissus de grande qualité, exclusivement destinés aux intérieurs royaux. Le peintre Charles LeBrun (1619-1690) en a la direction. En 1664, Colbert crée la manufacture de Beauvais, pour concurrencer les manufactures de tapisserie des Flandres. Les couleurs les plus appréciées pour les tissus de cette période sont des rouges riches, le rose, un bleu tirant sur le turquoise (bleu Médicis), un jaune rosé et un vert menthe profond (vert Médicis). On trouvait également le corail, le pêche, le brun. L'or et l'argent étaient utilisés pour les tissus d'ameublement et les tapisseries. Les motifs utilisés incluaient de grandes volutes, des guirlandes de fleurs, des feuilles d'acanthe comprenant des fruits comme des ananas ou des grenades. On trouvait fréquemment des fontaines et des paniers. C'est aussi à cette période que l'on voit se développer le style ""bizarre"", caractérisé par des formes sans équivalent dans la nature. Les tissus sont souvent des velours - poursuivant ainsi la tradition des riches velours de la Renaissance -, des damas, des brocarts ou encore des brochés. La soie devient alors la reine des fibres. Pour plus d'informations, on pourra consulter ""Style Louis XIV"".","Jules Guiffrey, Les manufacture nationales des tapisseries. Les Gobelins et Beauvais, Librairie Renouard, Paris, 1907 ; Karla J. Nielson, Interior Textiles: Fabrics, Application, and Historic Style, John Wiley & Sons, 2007.",,,,,,,,,,,,,,,,
