ID-ES,TERM-ES,ID,TERME,Qualifier,DEFINITION INITIALE,DEFINITION FINALE,BIBLIOGRAPHIE,SYNONYMES,OBSERVATION,,,,,,,,,,,,,,
1,Acanalado,1,côtelé,attribut,Tissu de soie plus spécialement à Reims,"Adj. Du lat. costa, côté, qui a donné, sur le plan anatomique ,""côtes"". Terme appliqué à certains tissus qui présentent des lignes en relief très saillantes. ex.: Velours côtelé, à grosses côtes…qui sont effectués en divers matériaux et techniques.",". BOUCHER,Jean-Jacques, Le dictionnaire de la soie : découvrir son histoire de ses origines jusqu'à nos jours, Paris, F. Lanore, 2015, p.  159
. CIETA, Vocabulaire français, Lyon, Centre International d’Etude des Textiles Anciens, 2020, p. 10
. CNRTL : https://www.cnrtl.fr/definition/c%C3%B4tel%C3%A9
. HARDOUIN-FUGIER Élisabeth, BERTHOD Bernard et CHAVENT-FUSARO Elisabeth, Les étoffes : dictionnaire historique, Editions de l'amateur, Paris, 1994, p. 148 p. 148
. FALCOT P., Traité encyclopédique et méthodique de la fabrication des tissus, Elbeuf, chez l'auteur, Mulhouse, Risler, 1852, p. 644",,,,,,,,,,,,,,,,"1--côtelé--Adj. Du lat. costa, côté, qui a donné, sur le plan anatomique ,""côtes"". Terme appliqué à certains tissus qui présentent des lignes en relief très saillantes. ex.: Velours côtelé, à grosses côtes…qui sont effectués en divers matériaux et techniques."
2,Acanalado,2,Cannelé,armure,"Armure à côtes parallèles à la trame, formées par des flottés de chaîne. Lorsque le mot cannelé n'est suivi d'aucun qualificatif, il désigne une armure à rapport de 2 fils dont les côtes sont uniquement dues à l'insertion de plusieurs coups de trame consécutifs dans le même pas.","Part. passé adjectivé et substantivé de canneler. Armure caractérisée par des flottés de chaînes reposant sur un tissu le plus souvent taffetas, ce qui réalise le plus souvent des côtes parallèles. Il en existe deux catégories : les cannelés simpletés et les cannelés doubletés
","Boucher, Jean-Jacques. Le dictionnaire de la soie: découvrir son histoire de ses origines jusqu’à nos jours. Paris: F. Lanore, 2015, p.  114 ; CIETA, Guelton, Marie-Hélène et Valansot, Odile (dir.). Vocabulaire technique français Lyon: Centre international d’étude des textiles anciens, 2020, p. 5 ; Encyclopédie ou Dictionnaire raisonné des sciences, des arts et des métiers. Tome I, A-Azyme / par une société de gens de lettres, Diderot, Denis et Le Rond dit D'Alembert, Jean (dir.), Paris : Briasson, David L'aîné, Lebreton, Durand,1751-1772. https://artflsrv03.uchicago.edu/philologic4/encyclopedie1117/navigate/2/5229/?byte=7897682 ; Hardouin-Fugier, Élisabeth, Berthod, Bernard, Chavent-Fusaro, Martine et Déprez, Camille. Les étoffes :  dictionnaire historique. Paris: les Éd. de l’Amateur, 1994, p. 125 ; LAMI Eugène-Oscar. Dictionnaire encyclopédique et biographique de l'industrie et des arts industriels. Paris: Maréchal et Montorier,1882, Tome II. https://gallica.bnf.fr/ark:/12148/bpt6k397805/f157.item ; Villard, Claude. Manuel de théorie du tissage, Tome I, Lyon: A. Rey, 1948, p. 175",,,,,,,,,,,,,,,,"2--Cannelé--Part. passé adjectivé et substantivé de canneler. Armure caractérisée par des flottés de chaînes reposant sur un tissu le plus souvent taffetas, ce qui réalise le plus souvent des côtes parallèles. Il en existe deux catégories : les cannelés simpletés et les cannelés doubletés
"
4,Acanalado alterno,4,Cannelé doubleté,armure,"Armure dont les côtes, constitués par des flottés de chaîne à l'endroit et par uen armure (généralement taffetas) à l'envers, sont alternativement formées par les fils impairs et des fils pairs.","Loc. masc. Le cannelé doubleté est obtenu avec une seule chaîne. Armure dont les côtes sont formées par des flottés de chaine à l'endroit et par une armure taffetas à l'envers, alternativement par les fils impairs et les fils pairs. ","CIETA, Guelton, Marie-Hélène et Valansot, Odile (dir.). Vocabulaire technique français Lyon: Centre international d’étude des textiles anciens, 2020, p. 5 ; Peyot, F., Cours complet de fabrique pour les étoffes de soie, Lyon: Perrin,1866, p. 4, 13 ; Villard, Claude. Manuel de théorie du tissage, Tome I, Lyon: A. Rey, 1923, p. 181-82
",Cannelé alternatif,,,,,,,,,,,,,,,"4--Cannelé doubleté--Loc. masc. Le cannelé doubleté est obtenu avec une seule chaîne. Armure dont les côtes sont formées par des flottés de chaine à l'endroit et par une armure taffetas à l'envers, alternativement par les fils impairs et les fils pairs. "
5,Acanalado con dos urdimbres,5,Cannelé simpleté,armure,Armure caractérisée par un jeu uniforme des fils d'une chaîne poil. Ces derniers flottent ensemble au-dessus d'une croisure des fils pièce puis lient en passant ensemble à l'envers pendant un ou deux coups.,"Le cannelé simpleté est un effet de poil traînant sur un fond taffetas. Il est formé de deux chaînes : l'une toile à peu près invisible à l'endroit, qui forme la base du tissu et qui travaille en taffetas. Les fils de la deuxième chaine, dite poil ou cannelé, flottent au-dessus de la croisure des fils pièce puis lient en passant à l'envers pendant un ou deux coup. Cette catégorie comprend le cannelé simpleté, le cannelé des Indes et le cannetillé, entre autres.","CIETA, Guelton, Marie-Hélène et Valansot, Odile (dir.). Vocabulaire technique français Lyon: Centre international d’étude des textiles anciens, 2020, p. 5 ; Peyot, F., Cours complet de fabrique pour les étoffes de soie, Lyon: Perrin,1866, p. 12 ; Villard, Claude. Manuel de théorie du tissage, Tome I, Lyon: A. Rey, 1948, p.  175
",,,,,,,,,,,,,,,,"5--Cannelé simpleté--Le cannelé simpleté est un effet de poil traînant sur un fond taffetas. Il est formé de deux chaînes : l'une toile à peu près invisible à l'endroit, qui forme la base du tissu et qui travaille en taffetas. Les fils de la deuxième chaine, dite poil ou cannelé, flottent au-dessus de la croisure des fils pièce puis lient en passant à l'envers pendant un ou deux coup. Cette catégorie comprend le cannelé simpleté, le cannelé des Indes et le cannetillé, entre autres."
6,Acanalado contramostrado,6,Cannetillé,armure,"Armure dont les fils poil forment des flottés contresemplés par groupes, au-dessus d'une croisure des fils pièce, selon le principe du cannelé simpleté. L'aspect classique du cannelé est en partie détruit et les côtes sont remplacées par de petits carreaux ou rectangles imbriqués.","Subst. masc. Entre dans la catégorie des cannelés simpletés, qui sont exécutés avec deux chaînes. Armure dont les fils poil forment des flottés par groupes de fils, au-dessus d'une croisure des fils pièce. L'aspect géométrique du cannelé est en partie détruit et les côtes sont remplacées par de petits carreaux ou rectangles imbriqués.","CIETA, Guelton, Marie-Hélène et Valansot, Odile (dir.). Vocabulaire technique français Lyon: Centre international d’étude des textiles anciens, 2020, p. 5 ; Peyot, F., Cours complet de fabrique pour les étoffes de soie, Lyon: Perrin,1866, p. 12 ; Villard, Claude. Manuel de théorie du tissage, Tome I, Lyon: A. Rey, 1948, p. 179- 80",,,,,,,,,,,,,,,,"6--Cannetillé--Subst. masc. Entre dans la catégorie des cannelés simpletés, qui sont exécutés avec deux chaînes. Armure dont les fils poil forment des flottés par groupes de fils, au-dessus d'une croisure des fils pièce. L'aspect géométrique du cannelé est en partie détruit et les côtes sont remplacées par de petits carreaux ou rectangles imbriqués."
7,Acanalado de las Indias,7,Cannelé des Indes,armure,"Armure dont les côtes, très faiblement marquées, sont formées par des flottés contresemplés des fils d'une chaîne poil, au-dessus d'une croisure d'envers produite par une chaîne pièce.","Loc. masc. Entre dans la catégorie des cannelés simpletés, qui sont exécutés avec deux chaînes. Armure réalisée par des flottés contresemplés des fils d'une chaîne poil avec une croisure d'envers produite par une chaîne de toile qui travaille en taffetas. Les côtes sont peu marquées.","CIETA, Guelton, Marie-Hélène et Valansot, Odile (dir.). Vocabulaire technique français Lyon: Centre international d’étude des textiles anciens, 2020, p. 5 ; Villard, Claude. Manuel de théorie du tissage, Tome I, Lyon: A. Rey, 1948, p.  177-178",,,,,,,,,,,,,,,,"7--Cannelé des Indes--Loc. masc. Entre dans la catégorie des cannelés simpletés, qui sont exécutés avec deux chaînes. Armure réalisée par des flottés contresemplés des fils d'une chaîne poil avec une croisure d'envers produite par une chaîne de toile qui travaille en taffetas. Les côtes sont peu marquées."
400,Acanalado longitudinal,400,Cannelé longitudinal,,,Loc. masc. Un cannelé longitudinal est un cannelé par effet de trame qui forme des sillons ou cannelures dans le sens longitudinal de l'étoffe (parallèle aux lisières). ,"Falcot, P. Traité encyclopédique et méthodique de la fabrication des tissus. 2e édition entièrement revue, corrigée et augmentée de plus du double. 2 vol. Elbeuf: l’auteur, Mulhouse, Risler, 1852, p. 128 ; Lami Eugène-Oscar. Dictionnaire encyclopédique et biographique de l'industrie et des arts industriels. Paris: Maréchal et Montorier,1882, T. 2. p. 153. https://gallica.bnf.fr/ark:/12148/bpt6k397805/f157.item
",Cannelé vertical,,,,,,,,,,,,,,,400--Cannelé longitudinal--Loc. masc. Un cannelé longitudinal est un cannelé par effet de trame qui forme des sillons ou cannelures dans le sens longitudinal de l'étoffe (parallèle aux lisières). 
399,Acanalado oblícuo,399,Cannelé oblique,,,Loc. masc. Cannelé qui présente des côtes obliques. .,"Falcot, Pierre. Traité encyclopédique et méthodique de la fabrication des tissus. Tome 1, Elbeuf: l’auteur, Mulhouse: Risler, 1852, p. 127-29 ; LAMI Eugène-Oscar et THAREL Alfred., Dictionnaire encyclopédique et biographique de l'industrie et des arts industriels, Paris, 1881-1891, 2, p. 153; Office du travail de Belgique, Monographies industrielles. Aperçu économique, technologique et commercial. Groupe VIII. L'industrie du tissage en Belgique, Bruxelles : J. Lebègue & cie., 1923.
",,,,,,,,,,,,,,,,9--Aceituni--Loc. masc. Cannelé qui présente des côtes obliques. .
401,Acanalado transversal,401,Cannelé transversal,,,"Loc. masc. Le cannelé est transversal lorsque les côtes sont produites par le flotté des fils de chaîne. Les sillons transversaux (perpendiculaire aux lisières) sont très accusés. On dit aussi ""cannelé ordinaire"".","Falcot, P. Traité encyclopédique et méthodique de la fabrication des tissus. 2e édition entièrement revue, corrigée et augmentée de plus du double. 2 vol. Elbeuf: l’auteur, Mulhouse, Risler, 1852, p. 128 ; Lami Eugène-Oscar. Dictionnaire encyclopédique et biographique de l'industrie et des arts industriels. Paris: Maréchal et Montorier,1882, T. 2. p. 153. https://gallica.bnf.fr/ark:/12148/bpt6k397805/f157.item
",Cannelé effet chaîne,,,,,,,,,,,,,,,"10--Damassé--Loc. masc. Le cannelé est transversal lorsque les côtes sont produites par le flotté des fils de chaîne. Les sillons transversaux (perpendiculaire aux lisières) sont très accusés. On dit aussi ""cannelé ordinaire""."
,,,,,,,,,,,,,,,,,,,,,,,12--Blaze--
9,Aceituní ,9,Aceituni,tissu,,"Terme esp. venant de l'arabe seitouni ou avec l'article az-zeitouni. Dans la ville chinoise de Tseu-thoung (en arabe Zeïtoûn), on fabriquait des étoffes damassées de velours et de satin qui avaient une très grande réputation et qui portaient l'appellation de ""zeitouni"". Rappelons que le mot satin vient de ce même terme arabe.","Dozy, Reinhart et Engelmann, Willem. Glossaire des mots espagnols et portugais dérivés de l'arabe. Leyde: Brill, 1869, p. 340. ",Setuni,,,,,,,,,,,,,,,"----Terme esp. venant de l'arabe seitouni ou avec l'article az-zeitouni. Dans la ville chinoise de Tseu-thoung (en arabe Zeïtoûn), on fabriquait des étoffes damassées de velours et de satin qui avaient une très grande réputation et qui portaient l'appellation de ""zeitouni"". Rappelons que le mot satin vient de ce même terme arabe."
8,Acolchado,8,Matelassé,,"Tissu façonné essentiellement caractérisé par des parties en fort relief réalisées d'après la technique du double-étoffe et l'appoint d'une trame, dite trame de bourré, insérée entre les croisure d'endroit et d'envers","Subst. masc. Le matelassé est un tissu façonné double étoffe composé de deux tissus indépendants : l'un présentant des effets variés, forme le côté endroit et l'autre, d'une contexture grossière, forme le côté envers. Entre les deux tissus se trouve une nappe de trame coton (dite trame de ""bourré""), quelque fois laine, destinée à faire de l'épaisseur. Pour donner à l'étoffe le caractère matelassé, les deux tissus sont réunis par une piqûre, en suivant les directives du dessin. En fonction de la composition de la pièce d'endroit, on a des ""matelassés unis"" (composés de deux chaînes et de trois trames) ou des ""matelassés façonnés (de même contexture avec un pièce d'endroit décorée par des effets variés).","Bezon, Jean. Dictionnaire général des tissus anciens et modernes.‎ Tome 6. ‎ Lyon: Th. Lepagnez, 1862, p. 453-459 ; CIETA, Guelton, Marie-Hélène et Valansot, Odile (dir.). Vocabulaire technique français Lyon: Centre international d’étude des textiles anciens, 2020, p. 31 ; Lami, Eugène-Oscar. Dictionnaire encyclopédique et biographique de l'industrie et des arts industriels. Tome 6. Paris: Librairie Des Dictionnaires,1886, p. 339 ",,,,,,,,,,,,,,,,"8--Matelassé--Subst. masc. Le matelassé est un tissu façonné double étoffe composé de deux tissus indépendants : l'un présentant des effets variés, forme le côté endroit et l'autre, d'une contexture grossière, forme le côté envers. Entre les deux tissus se trouve une nappe de trame coton (dite trame de ""bourré""), quelque fois laine, destinée à faire de l'épaisseur. Pour donner à l'étoffe le caractère matelassé, les deux tissus sont réunis par une piqûre, en suivant les directives du dessin. En fonction de la composition de la pièce d'endroit, on a des ""matelassés unis"" (composés de deux chaînes et de trois trames) ou des ""matelassés façonnés (de même contexture avec un pièce d'endroit décorée par des effets variés)."
10,Adamascado ,10,Damassé,,Terme général utilisé pour désigner des tissus dont le décor procède du contraste d'armures des damas et dont l'aspect s'apparente à ceux-ci,Adj. Dérivé de damas. Terme qui désigne les tissus dont l'aspect ressemble à celui des damas.,"CIETA. Vocabulaire français. Lyon: Centre  International d’Etude des Textiles Anciens, 1997. CNRTL, https://cnrtl.fr/definition/damass%C3%A9. Dictionnaire de l'Académie française, https://www.dictionnaire-academie.fr/article/A9D0052",,,,,,,,,,,,,,,,15--Peluché--Adj. Dérivé de damas. Terme qui désigne les tissus dont l'aspect ressemble à celui des damas.
,,,"
",,,,,,,,,,,,,,,,,,,,"--
--"
12,Adúcar  ,12,Blaze,,"Partie du cocon, constituée des premiers filaments soyeux sécrétés par la chenille du bombyx, qui fournit une soie grossière.","Subst. fém. Ce terme désigne le réseau de fils irréguliers qui enveloppe le cocon, formé par le premier fil émis par le vers à soie. C'est l'un des ""déchets de soie"", séparé au moment du battage des cocons, qui sera traité en filature de schappe. Les appellations varient en fonction des régions.","Académie française. « Dictionnaire de l’Académie française », https://www.lalanguefrancaise.com/dictionnaire/definition/blase ; Clavairolle, Françoise. Sériciculture en Cévennes, Essai d'anthropologie historique et sociale sur la dynamique des savoirs et de la production. Thèse d'ethnologie. Paris: EHESS, 1997, p. 533 ; PARISET Ernest, Les industries de la soie, sériciculture, filature, moulinage, tissage, teinture. Histoire et statistique, Lyon, Pitrat aîné, 1862, p. 56 ; Villard, Claude. Manuel de théorie du tissage. Tome I. Lyon: A. Rey, 1948. p.11; VIEIL, Pierre. Sériciculture. Paris: J.-B. Baillière et fils, 1920
",Strasse,,,,,,,,,,,,,,,#REF!
14,Adúcar  ,14,Soie contaille,,Ancienne étoffe de soie grossière,"Loc. masc. De contailler, ""mettre en pièces, en lambeaux"". Soie de basse qualité.",,,,,,,,,,,,,,,,,"14--Soie contaille--Loc. masc. De contailler, ""mettre en pièces, en lambeaux"". Soie de basse qualité."
15,Afelpado ,15,Peluché,,,Adj. Dér. de pelucher. Qui a l'apparence de la peluche. Fait d'un tissu semblable à la peluche.,"CNRTL, https://www.cnrtl.fr/definition/peluché",Pelucheux,"
",,,,,,,,,,,,,,20--Alberoni--Adj. Dér. de pelucher. Qui a l'apparence de la peluche. Fait d'un tissu semblable à la peluche.
17,Afelpar,17,Pelucher,,,"Vb. intr. En français, le terme ""pelucher"" décrit le fait qu'une étoffe prend un aspect pelucheux à cause de l'usure du tissu (par frottement par ex.) dont des fils commencent à s'échapper. Ici, le terme fait référence au fait que l'on donne au tissu travaillé l'aspect de la peluche (voir le terme ""Afelpar"" en espagnol). Il ne semble pas être utilisé en français dans ce sens.","CNRTL, https://www.cnrtl.fr/definition/peluché",,,,,,,,,,,,,,,,"17--Pelucher--Vb. intr. En français, le terme ""pelucher"" décrit le fait qu'une étoffe prend un aspect pelucheux à cause de l'usure du tissu (par frottement par ex.) dont des fils commencent à s'échapper. Ici, le terme fait référence au fait que l'on donne au tissu travaillé l'aspect de la peluche (voir le terme ""Afelpar"" en espagnol). Il ne semble pas être utilisé en français dans ce sens."
18,Agremán ,18,Agrément,,,"Subst. masc. Dér d’agréer. Terme utilisée en passementerie, et qui désigne des éléments réalisés à la main et utilisés pour orner des ouvrages comme les glands ou les franges.","Jean-Jacques Boucher, Le dictionnaire de la soie : découvrir son histoire de ses origines jusqu'à nos jours, Paris, F. Lanore, 2015, CNRTL, https://cnrtl.fr/definition/agr%C3%A9ment ; Dictionnaire de l'Académie française, https://www.dictionnaire-academie.fr/article/A9A0912.",Ornement,,,,,,,,,,,,,,,"18--Agrément--Subst. masc. Dér d’agréer. Terme utilisée en passementerie, et qui désigne des éléments réalisés à la main et utilisés pour orner des ouvrages comme les glands ou les franges."
,,,,,,,,,,,,,,,,,,,,,,,
20,Alberoni,20,Alberoni,tissu,,"Du nom du cardinal Jules Alberoni (1664-1752), ministre du roi d'Espagne Philippe V. Au XVIIe siècle, on avait donné le nom du célèbre cardinal à une sorte de camelot qui se fabriquait à Leyde et dont la vogue se soutint pendant bien des années. Il était tissé avec une chaine de soie et de fil d'or, et la trame de soie ou de poil de chèvre d'Angora. On expédiait cette étoffe aux colonies espagnoles de l'Amérique. Au XVIe siècle, on faisait déjà en France des tissus du même genre que les comptes et inventaires de l'époque mentionnaient comme des barracans (genre de camelots) de soie et de fil d'or. 
","Bezon, Jean. Dictionnaire général des tissus anciens et modernes.‎Tome 7. Lyon: Th. Lepagnez, 1862, p. 317 ",,,,,,,,,,,,,,,,"25--Alépine--Du nom du cardinal Jules Alberoni (1664-1752), ministre du roi d'Espagne Philippe V. Au XVIIe siècle, on avait donné le nom du célèbre cardinal à une sorte de camelot qui se fabriquait à Leyde et dont la vogue se soutint pendant bien des années. Il était tissé avec une chaine de soie et de fil d'or, et la trame de soie ou de poil de chèvre d'Angora. On expédiait cette étoffe aux colonies espagnoles de l'Amérique. Au XVIe siècle, on faisait déjà en France des tissus du même genre que les comptes et inventaires de l'époque mentionnaient comme des barracans (genre de camelots) de soie et de fil d'or. 
"
,,,,,,,,,,,,,,,,,,,,,,,27--Endroit--
,,,,,,,,,,,,,,,,,,,,,,,28--Tapis--
23,Alcatifa ,23,Alcatifa,,Tapis fin,"Subst. fém. Terme portugais signifiant ""tapis"" ou ""moquette"". Désigne un fin tapis provenant d'Inde, réalisé en soie et fils d'or ou d'argent, richement brodé et utilisé comme tapis d'estrade (""alcatifa de estrado"") en été, sous des dais installés à l'intérieur. Il pouvait aussi être utilisé pour recouvrir le sol.","Melchior Emmanuel Núñez de Taboada, Dictionnaire espagnol-français, dixième édition, P.-J. Rey, 1847, Tome second ; Barbara Karl, Embroidered Histories. Textile  for the Portuguese Market During the Sixteenth and Seventeenth Centuries, Wien, Böhlau Verlag, 2016.",,,,,,,,,,,,,,,,"29--Âme--Subst. fém. Terme portugais signifiant ""tapis"" ou ""moquette"". Désigne un fin tapis provenant d'Inde, réalisé en soie et fils d'or ou d'argent, richement brodé et utilisé comme tapis d'estrade (""alcatifa de estrado"") en été, sous des dais installés à l'intérieur. Il pouvait aussi être utilisé pour recouvrir le sol."
25,Alepín ,25,Alépine,tissu,Etoffe formée de soie et de laine peignée,"Subst. fém. Etoffe à armure batavia avec une chaîne de soie et d'une trame de laine peignée La fabrication de l'alépine, tout d'abord mise en œuvre par les Anglais, ne s'introduisit que vers 1790 en France, où elle devint l'objet d'un commerce assez étendu, soit pour la consommation intérieure, soit pour l'exportation. Sa fabrication fut longtemps concentrée dans la seule ville d'Amiens. Les alépines se teignaient en pièces, ordinairement en couleur noire. Elles étaiebt employées principalement pour les vêtements de femmes, surtout pour le deuil. Dans certaines contrées méridionales, elle servait pour des vêtements d'hommes.","Académie française. « Dictionnaire de l’Académie française », https://www.dictionnaire-academie.fr/article/A9A1129 ; Bezon, Jean. Dictionnaire général des tissus anciens et modernes.‎Tome 8. ‎ Paris: Savy, 1863, p. 526 ; « Centre National de Ressources Textuelles et Lexicales », https://www.cnrtl.fr/definition/al%C3%A9pine ; Falcot, Pierre. Traité encyclopédique et méthodique de la fabrication des tissus. Tome 1,Elbeuf: l’auteur, Mulhouse: Risler, 1852, p. 82 ; Hardouin-Fugier, Élisabeth, Berthod, Bernard, Chavent-Fusaro, Martine et Déprez, Camille. Les étoffes :  dictionnaire historique. Paris: l’Amateur, 1994, p.  64",,,,,,,,,,,,,,,,
,,,,,,,,,,,,,,,,,,,,,,,30--Face trame--
28,Alfombra ,28,Tapis,,"Panneau d'étoffe ouvragé que l'on pose sur un meuble, un mur ou un sol","Subst. masc. Du lat. tapes, issu du gr. ancien tápes. Pièce de tissu dont on couvre les murs, les meubles ou le sol.","CNRTL. https://cnrtl.fr/definition/tapis. Dictionnaire de l'Académie française, https://www.dictionnaire-academie.fr/article/A8T0155. Encyclopédie ou Dictionnaire raisonné des sciences, des arts et des métiers, par une Société de Gens de lettres, https://artflsrv03.uchicago.edu/philologic4/encyclopedie1117/navigate/15/4289/?byte=9889338",,,,,,,,,,,,,,,,#REF!
29,Alma ,29,Âme,,Fil autour duquel est enroulé un autre fil,"Subst. fém. Du lat. anima. Désigne la partie centrale d'un objet. Dans le tissage, désigne un fil autour duquel un autre fil est enroulé.","CIETA. Vocabulaire français. Lyon: Centre  International d’Etude des Textiles Anciens, 1997 ; CNRTL, https://cnrtl.fr/definition/%C3%A2me ; Dictionnaire de l'académie française, https://www.dictionnaire-academie.fr/article/A9A1428",,,,,,,,,,,,,,,,
,,,,,,,,,,,,,,,,,,,,,,,----
32,Anafaya ,32,Anafaya,,,"Subs. fém. De l'ar. an-nafâya. Etoffe espagnole réalisée avec la bourre de soie, et peut-être de la bourre de soie et de coton.","Melchior Emmanuel Núñez de Taboada, Dictionnaire espagnol-français, dixième édition, P.-J. Rey, 1847, Tome second ; Reinhart Pieter Anne Dozy, Glossaire des mots espagnols et portugais dérivés de l'arabe, Leyde Brill, 1869.",,,,,,,,,,,,,,,,"36--Anacoste --Subs. fém. De l'ar. an-nafâya. Etoffe espagnole réalisée avec la bourre de soie, et peut-être de la bourre de soie et de coton."
36,Anascote ,36,Anacoste ,tissu,Etoffe dont la chaîne et la trame sont en laine et à double croisure ou sorte de serge dont la chaîne et la trame sont à double croisure,"Subst. fém. Empr. à l'esp. anascote ""sorte de serge"" attesté dep. 1527, lui-même issu d'Hondschoote, nom d'une ville flamande (département du Nord) où cette étoffe était fabriquée. Le tissu désigné sous cette dénomination est ras, à double croisure. L'armure est un sergé de 4 par 1/2, ou armure dite batavia. La chaîne et la trame sont en laine peignée. Cette étoffe, fabriquée comme les serges de Caen, mais de meilleure laine, se fabriquait au XVIIIe siècle, à Leyde et à Bruges. puis plus tard à Amiens et aux environs. On l'employait pour les vêtements ecclésiastique ou militaires, ou pour les costumes de bains.","Bezon, Jean. Dictionnaire général des tissus anciens et modernes.‎Tome 8. ‎ Paris: Savy, 1863, p. 57 ; « Centre National de Ressources Textuelles et Lexicales », https://cnrtl.fr/definition/anacoste ; Encyclopédie ou Dictionnaire raisonné des sciences, des arts et des métiers. Tome premier, A-Azyme / par une société de gens de lettres, Diderot, Denis et Le Rond dit D'Alembert, Jean (dir.), Paris : Briasson, David L'aîné, Lebreton, Durand,1751-1772, https://artflsrv03.uchicago.edu/philologic4/encyclopedie1117/navigate/1/2436/?byte=5037954 ; Hardouin-Fugier, Élisabeth, Berthod, Bernard, Chavent-Fusaro, Martine et Déprez, Camille. Les étoffes :  dictionnaire historique. Paris: l’Amateur (1994), 2005, p. 66",,,,,,,,,,,,,,,,
