ID-ES,TERM-ES,ID,TERME,Qualifier,DEFINITION INITIALE,DEFINITION FINALE,BIBLIOGRAPHIE,SYNONYMES,OBSERVATION,,,,,,,,,,,,,,
236,Tafetán,236,Taffetas,armure,"Armure dont le rapport se limite à deux fils et deux coups et dans laquelle les fils impairs et pairs alternent à chaque coup, au-dessus et au-dessus de la trame","Subst. masc. D'orig. incert., viendrait peut-être du mot pers. taftâ, signifiant ""ce qui est tissé"", transformé en ital. taffeta. Ce terme désigne l'armure la plus simple dont le rapport se limite à deux fils et deux coups, les fils pairs et impairs alternant à chaque coup, au-dessus puis au-dessous de la trame. En français, la désignation ""armure taffetas"" remplace de façon exclusive celle d""'armure toile"" lorsque l'on tisse de la soie.","Bezon, Jean. Dictionnaire général des tissus anciens et modernes. ‎Tome 1.‎ Lyon : Th. Lepagnez, 1859, p. 23-124 ; Boucher, Jean-Jacques. Le dictionnaire de la soie: découvrir son histoire de ses origines jusqu’à nos jours. Paris: F. Lanore, 2015, p. 589 ; CIETA, Guelton, Marie-Hélène et Valansot, Odile (dir.). Vocabulaire technique français Lyon: Centre international d’étude des textiles anciens, 2020, p. 50 ; Hardouin-Fugier, Élisabeth, Berthod, Bernard, Chavent-Fusaro, Martine et Déprez, Camille. Les étoffes :  dictionnaire historique. Paris: l’Amateur, 1994, p. 25 ; Villard, Claude. Manuel de théorie du tissage. Tome I. Lyon: A. Rey, 1948, p. 128
",,,,,,,,,,,,,,,,"453--Teint en fils--Loc. masc. Du latin tinctura qui donne l’ancien français tainture. On donne le nom de teinture à la succession d'opérations qui sont nécessaires pour donner une coloration variée. La teinture s'exécute 1. soit sur le fil disposé en flotte, c'est la ""teinture en flotte"" ou ""en fils"". Elle peut se faire sur un soie crue, une soie souple (décreusage partiel), ou une soie cuite (totalement décreusée). On procède quelquefois au blanchiment de la soie cuite par du soufre pour les teintures claires. 2. sur le tissu fabriqué, c'est la teinture en pièce (voir ce terme)."
377,Tafetán,377,Taffetas,tissu,Tissu de soie exécuté d'après l'armure taffetas,"Subst. masc. D'orig. incert., viendrait peut-être du mot pers. taftâ, signifiant ""ce qui est tissé"", transformé en ital. taffeta. Les auteurs d'ouvrages sur la soie emploient le mot taffetas pour tout tissu de soie qui a été confectionné selon l'armure taffetas (armure toile) sauf, généralement, lorsque l'un des éléments est dans une autre matière (coton, lin) ou même lorsqu'il s'agit de fil de schappe. Par exemple, pour Jean Bezon (1859) – bien qu'il les classe tous parmi les taffetas – la ""marceline"" (t.1, p. 84) ""est aussi un taffetas […]"", en revanche les ""grisettes"" (t.1, p. 89) ""'étaient de petites étoffes légères, ordinairement mêlées de soie, de laine, de fil, de poil ou de coton, et quelquefois toutes de laine"" et la ""papeline"" (t.1, p. 96) ""était une étoffe légère, dont la chaîne était de soie et la trame de fleuret ou filoselle"". Le présent thésaurus en langue française suit cet usage. Le caractère général du taffetas est qu'il présente sur deux faces identiques – sans envers, ni endroit – un aspect assez lisse et tendu avec un grain que forment les fils de trame, et les fils de chaînes. Il existe de multiples variétés de taffetas qui changent souvent d'appellation en fonction de leurs effets, de leur couleur, de la qualité des soies en chaîne ou en trame, de leur décor, de leur lieu de fabrication, etc.","Académie française. « Dictionnaire de l’Académie française », https://www.dictionnaire-academie.fr/article/A8T0049 ; Bezon, Jean. Dictionnaire général des tissus anciens et modernes. ‎Tome 1.‎ Lyon : Th. Lepagnez, 1859, p. 23-124 ; Boucher, Jean-Jacques. Le dictionnaire de la soie: découvrir son histoire de ses origines jusqu’à nos jours. Paris: F. Lanore, 2015, p. 569 ; CIETA, Vocabulaire français, Lyon, Centre International d’Etude des Textiles Anciens, 2020, p. 47 ; « Centre National de Ressources Textuelles et Lexicales », https://cnrtl.fr/definition/taffetas ; Hardouin-Fugier, Élisabeth, Berthod, Bernard, Chavent-Fusaro, Martine et Déprez, Camille. Les étoffes :  dictionnaire historique. Paris: l’Amateur, 1994, p. 25 ; Villard, Claude. Manuel de théorie du tissage. Tome I. Lyon: A. Rey, 1948, p. 128-148",,,,,,,,,,,,,,,,"454--Teint en pièce--Loc. masc. Du latin tinctura qui donne l’ancien français tainture. On donne le nom de teinture à la succession d'opérations qui sont nécessaires pour donner une coloration variée. La teinture s'exécute 1. soit sur le fil disposé en flotte, c'est la teinture en flotte ou en fils (voir ce terme). 2. sur le tissu fabriqué, c'est la teinture en pièce. Les tissus de soie pure subissent les mêmes préparations avant la teinture que les soies en flotte, c'est à dire qu'ils sont décreusés partiellement ou entièrement. On procède quelquefois au blanchiment de la soie cuite par du soufre pour les teintures claires. "
450,Telar,450,Métier (à tisser),,"Instrument plus ou moins perfectionné, sur lesquels sont tenus les fils de chaîne et où l'on peut, par divers procédés, obtenir le passage de la trame entre deux nappes de fil séparées","Subst. masc. Du lat. ministerium ""fonction de serviteur"". Machine qui sert à la fabrication du tissu. On parle de ""métier à tisser"", ou plus simplement ""métier"".","CIETA. Vocabulaire français. Lyon: Centre  International d’Etude des Textiles Anciens, 1997",,,,,,,,,,,,,,,,"455--Velours au sabre--Subst. masc. Du lat. ministerium ""fonction de serviteur"". Machine qui sert à la fabrication du tissu. On parle de ""métier à tisser"", ou plus simplement ""métier""."
448,Telar  de varillas,448,Métier à baguettes,,"Métier permettant l'exécution d'étoffes façonnées par une sélection des fils de chaîne effectuée au moyen de baguettes munies, ou non, de boucles",Loc. masc. Métier à tisser utilisé pour produire des tissus façonnés au moyen de baguettes qui sélectionnent les fils de chaîne.,"CIETA. Vocabulaire français. Lyon: Centre  International d’Etude des Textiles Anciens, 1997",,,,,,,,,,,,,,,,456--Velours ciselé--Loc. masc. Métier à tisser utilisé pour produire des tissus façonnés au moyen de baguettes qui sélectionnent les fils de chaîne.
451,Telar de botones ,451,Métier aux boutons,,"Genre de métier à la tire, à rame horizontal où les lacs, gansés directement sur les cordes de rame, sont réunies à de petites quilles appelées boutons, sur lesquelles le tireur agit successivement","Loc. masc. Sorte de métier à la tire, à rame horizontale, dont les lacs directement attachés aux cordes de la rame sont reliés à des poignées ou ""boutons"", que le tisseur actionne.","CIETA. Vocabulaire français. Lyon: Centre  International d’Etude des Textiles Anciens, 1997",Métier à la petite tire,,,,,,,,,,,,,,,#REF!
446,Telar de cartones,446,Métier aux plaquettes,,Ensemble de plaquettes polygonales (le plus souvent carrées) percées aux angles pour recevoir les fils de chaînes et disposées côte à côte parallèlement aux fils de chaîne,"Loc. masc. Ce métier fonctionne avec des plaquettes polygonales (le plus souvent carrées) qui ont des trous dans leurs angles, à travers lesquels passent les fils de chaîne.","CIETA. Vocabulaire français. Lyon: Centre  International d’Etude des Textiles Anciens, 1997",Métier aux cartons,,,,,,,,,,,,,,,#REF!
449,Telar de tiro,449,Métier à la tire,,Métier créé pour l'exécution des étoffes façonnées,"Loc. masc. Métier à tisser qui apparaît à la fin du Moyen Âge en Italie et est importé au début du XVIIème siècle à Lyon. Il est ensuite perfectionné par Claude Dangon. Le métier à la tire permet de confectionner des tissus façonnés - c'est pour cette raison qu'il sera également appeler ""métier de façonné"" -, jusqu'ici importés d'Italie qui en avait le monopole. Le métier se compose de quatre poutres câlées au plafond, tenues entre elles par des traverses. Les fils de chaîne partent d'un rouleau de bois situés à l'arrière, pour aller vers un rouleau situé à l'avant. ","CIETA. Vocabulaire français. Lyon: Centre  International d’Etude des Textiles Anciens, 1997 ; Marie-Hélène Guelton, « Les métiers à tisser : évolution des techniques », dans Lyon innove : inventions et brevets dans la soierie lyonnaise aux XVIIIe et XIXe siècles, Lyon, EMCC, coll. « Des objets qui racontent l'histoire », 2009 ; Bernard Tassinari, La soie à Lyon : de la Grande Fabrique aux textiles du xxie siècle, Lyon, Éditions Lyonnaises d'Art et d'Histoire, 2005 ; Yves Lequin (dir.), Françoise Bayard et Mathilde Dubesset, « Un monde de soie : Les siècles d'or des fabriques lyonnaises et stéphanoises (XVIIIe-XIXe siècles) », dans 500 années lumière : mémoire industrielle, Paris, Plon, 1991","Métier à la grande tire, Métier de façonné",,,,,,,,,,,,,,,"459--Velours façonné--Loc. masc. Métier à tisser qui apparaît à la fin du Moyen Âge en Italie et est importé au début du XVIIème siècle à Lyon. Il est ensuite perfectionné par Claude Dangon. Le métier à la tire permet de confectionner des tissus façonnés - c'est pour cette raison qu'il sera également appeler ""métier de façonné"" -, jusqu'ici importés d'Italie qui en avait le monopole. Le métier se compose de quatre poutres câlées au plafond, tenues entre elles par des traverses. Les fils de chaîne partent d'un rouleau de bois situés à l'arrière, pour aller vers un rouleau situé à l'avant. "
447,Telar Jacquard,447,Métier Jacquard,,"Expression courante, bien qu'inexacte, pour un métier à tisser équipée d'une mécanique Jacquard. Il faut lui préférer métier à mécanique Jacquard","Loc. masc. Du nom de Joseph-Marie Jacquard (1752-1834), qui inventa ce métier à tisser vers 1780. Métier à tisser qui utilise des cartons perforés, permettant d'obtenir mécaniquement des étoffes façonnées, présentant des dessins complexes et variés. Le terme peut être utilisée en apposition : ""Mécanique Jacquard"", ""Métier (à la) Jacquard"".","CIETA. Vocabulaire français. Lyon: Centre  International d’Etude des Textiles Anciens, 1997 ; CNRTL, https://cnrtl.fr/definition/jacquard ; Dictionnaire de l'Académie française, https://www.dictionnaire-academie.fr/article/A9J0033",,,,,,,,,,,,,,,,"460--Velours gaufré--Loc. masc. Du nom de Joseph-Marie Jacquard (1752-1834), qui inventa ce métier à tisser vers 1780. Métier à tisser qui utilise des cartons perforés, permettant d'obtenir mécaniquement des étoffes façonnées, présentant des dessins complexes et variés. Le terme peut être utilisée en apposition : ""Mécanique Jacquard"", ""Métier (à la) Jacquard""."
,,,,,,,,,,,,,,,,,,,,,,,461--Velours par la trame--
452,Teñido,452,Soie cuite,,Etat d'un fil de soie teint après avoir été totalement dépouillé de son grès,"Adj. du latin coquere. Une ""soie cuite"" ou ""cuit"" est une soie dépouillée entièrement du grès par l'opération de la cuite, c’est-à-dire un passage dans un bain de savon maintenu à ébullition pendant environ 30 à 45 minutes. Le grès est alors complètement dissout et la soie est décreusée. La soie cuite est formée de la fibroïne pure, elle est brillante, douce et craquante. Elle peut ensuite être teinte (teinte en cuite).","CIETA, Guelton, Marie-Hélène et Valansot, Odile (dir.). Vocabulaire technique français Lyon: Centre international d’étude des textiles anciens, 2020, p. 11 ; Pariset, Ernest. Les industries de la soie, sériciculture, filature, moulinage, tissage, teinture. Histoire et statistique, Lyon: Pitrat aîné, 1862, p. 221 ;Villard, Claude. Manuel de théorie du tissage. Tome I. Lyon: A. Rey, 1948, p. 66-68",Cuite,,,,,,,,,,,,,,,#REF!
453,Teñido en madeja,453,Teint en fils,,Expression utilisée pour désigner un tissu exécuté avec des fils préalablement teints en écheveaux,"Loc. masc. Du latin tinctura qui donne l’ancien français tainture. On donne le nom de teinture à la succession d'opérations qui sont nécessaires pour donner une coloration variée. La teinture s'exécute 1. soit sur le fil disposé en flotte, c'est la ""teinture en flotte"" ou ""en fils"". Elle peut se faire sur un soie crue, une soie souple (décreusage partiel), ou une soie cuite (totalement décreusée). On procède quelquefois au blanchiment de la soie cuite par du soufre pour les teintures claires. 2. sur le tissu fabriqué, c'est la teinture en pièce (voir ce terme).","CIETA, Guelton, Marie-Hélène et Valansot, Odile (dir.). Vocabulaire technique français Lyon: Centre international d’étude des textiles anciens, 2020, p. 49 ; Pariset, Ernest. Les industries de la soie, sériciculture, filature, moulinage, tissage, teinture. Histoire et statistique, Lyon: Pitrat aîné, 1862, p. 217-228 ; Villard, Claude. Manuel de théorie du tissage. Tome I. Lyon: A. Rey, 1948, p. 66-68",Teint en flotte,,,,,,,,,,,,,,,#REF!
454,Teñido en pieza,454,Teint en pièce,,Expression utilisée pour désigner un tissu ayant reçu une teinture après tissage,"Loc. masc. Du latin tinctura qui donne l’ancien français tainture. On donne le nom de teinture à la succession d'opérations qui sont nécessaires pour donner une coloration variée. La teinture s'exécute 1. soit sur le fil disposé en flotte, c'est la teinture en flotte ou en fils (voir ce terme). 2. sur le tissu fabriqué, c'est la teinture en pièce. Les tissus de soie pure subissent les mêmes préparations avant la teinture que les soies en flotte, c'est à dire qu'ils sont décreusés partiellement ou entièrement. On procède quelquefois au blanchiment de la soie cuite par du soufre pour les teintures claires. ","CIETA, Guelton, Marie-Hélène et Valansot, Odile (dir.). Vocabulaire technique français Lyon: Centre international d’étude des textiles anciens, 2020, p. 11 ; Pariset, Ernest. Les industries de la soie, sériciculture, filature, moulinage, tissage, teinture. Histoire et statistique, Lyon: Pitrat aîné, 1862, p. 121 ;Villard, Claude. Manuel de théorie du tissage. Tome I. Lyon: A. Rey, 1948, p. 66-68",,,,,,,,,,,,,,,,#REF!
379,Terciopelo,379,Velours,armure,Tissu dont la surface est couverte de boucles ou de poils dressés au-dessus d'une croisure de fond,"Subst. masc. Du lat. vilosus, ""velu"". Dans tout velours il y a deux chaînes : l'une, nommée toile, fait le fond de l'étoffe, l'autre, nommée poil, est destinée à être soulevée et à faire la côte du velours frisé ou la houppe du velours coupé. Le soulèvement du poil est réalisé à l'aide de petites tringles très minces en fer ou en cuivre qu'on nomme fers. On donne le nom de velours à des étoffes par effet de chaînes, qui se présentent de deux manières différentes. L'une présente des côtes arrondies formés par une succession de petits arceaux dans le sens de la trame, d'un aspect mat avec des reflets brillants : c'est le velours frisé. L'autre formé par des brins coupés à la même hauteur, c'est le velours coupé, dans lequel la surface est toute velue. ","CIETA, Guelton, Marie-Hélène et Valansot, Odile (dir.). Vocabulaire technique français Lyon: Centre international d’étude des textiles anciens, 2020, p. 53 ; Encyclopédie ou Dictionnaire raisonné des sciences, des arts et des métiers. Tome premier, A-Azyme / par une société de gens de lettres, Diderot, Denis et Le Rond dit D'Alembert, Jean (dir.), Paris : Briasson, David L'aîné, Lebreton, Durand,1751-1772, https://artflsrv03.uchicago.edu/philologic4/encyclopedie1117/navigate/16/4723/?byte=10020512 ; Lami, Eugène-Oscar. Dictionnaire encyclopédique et biographique de l'industrie et des arts industriels. Tome 8. Paris: Librairie Des Dictionnaires,1888, p. 931-933 ; Pariset, Ernest. Les industries de la soie, sériciculture, filature, moulinage, tissage, teinture. Histoire et statistique, Lyon: Pitrat aîné, 1862, p. 261 ; Villard, Claude. Manuel de théorie du tissage. Tome I. Lyon: A. Rey, 1948, p. 212",,,,,,,,,,,,,,,,#REF!
455,Terciopelo al sable,455,Velours au sabre,armure,"Velours de soie obtenu après tissage, en sectionnant des flottés de chaîne, ou parfois de trame, à l'aide d'une lame affilée (rasoir) glissée sous les flottés","Loc. masc. Mise en œuvre dans les années 1830 par le soyeux stéphanois Charles Rebour, la technique du velours au sabre fut d'abord utilisée pour les rubans, pour ensuite être appliquée plus largement à la soierie. Le velours au sabre est une armure produite avec une chaine toile qui travaille en taffetas, et une chaîne de poil ou satin qui forme le velours. La proportion des deux chaînes varie. La chaîne satin travaille d'après une armure en deux parties : une armure satin désignée d'après la longueur des flottés (soit la longueur des brins de velours). Chaque fil satin reçoit une deuxième liage qui permet d'attacher solidement le satin au taffetas de la toile (1 laissé, 1 pris). Après le tissage, on découpe au moyen d'un couteau très effilé appelé ""sabre"", en l'introduisant entre les lignes de flottés du satin et la toile taffetas. Le satin découpé et relevé à la brosse donne l'apparence du velours coupé avec poil sensiblement couché. En général, on découpe certaines parties seulement de l'étoffe. On obtient alors un genre de velours façonné dans lequel le nombre de couleurs nécessaire à rendre les effets est presque illimité. ","CIETA, Guelton, Marie-Hélène et Valansot, Odile (dir.). Vocabulaire technique français Lyon: Centre international d’étude des textiles anciens, 2020, p. 53 ; Villard, Claude. Manuel de théorie du tissage. Tome I. Lyon: A. Rey, 1948, p. 232-234",,,,,,,,,,,,,,,,#REF!
456,Terciopelo cincelado,456,Velours ciselé,armure,"Velours façonné formé par une ou plusieurs chaînes poil, dont l'effet de velours coupé est plus élevé sous l'effet de velours frisé","Loc. masc. Part. passé de ciseler. Le velours ciselé est un velours formé de deux parties principales : un fond sur toute la longueur et la largeur, généralement un gros de Tours ou un taffetas, et le poil composé de touffes ou de bouclettes. Le velours ciselé comprend donc deux sortes de velours : le velours coupé, composé de touffes de poils, et le velours frisé ou épinglé, composé de bouclettes de poil. Un velours ciselé est uniquement confectionné au moyen d'un métier à bras car les touffes de poil et les bouclettes sont exécutées à la main au moyen d'un rabot et de fers. ","Bezon, Jean. Dictionnaire général des tissus anciens et modernes.‎ Tome 2.‎ Lyon: Th. Lepagnez, 1859, p. 72 ; CIETA, Guelton, Marie-Hélène et Valansot, Odile (dir.). Vocabulaire technique français Lyon: Centre international d’étude des textiles anciens, 2020, p. 53 ; Demoule, Philippe.""Velours ciselé de soie"". Fil du Temps, la revue du CVMT, https://www2.cs.arizona.edu/patterns/weaving/webdocs/df1_velv.pdf ; Hardouin-Fugier, Élisabeth, Berthod, Bernard, Chavent-Fusaro, Martine et Déprez, Camille. Les étoffes :  dictionnaire historique. Paris: l’Amateur, 1994, p. 396 ; Tassinari, Bernard. La soie à Lyon: de la Grande fabrique aux textiles du XXIe siècle. Lyon: Ed. lyonnaises d’art et d’histoire, 2005, p. 59.",,,,,,,,,,,,,,,,"----Loc. masc. Part. passé de ciseler. Le velours ciselé est un velours formé de deux parties principales : un fond sur toute la longueur et la largeur, généralement un gros de Tours ou un taffetas, et le poil composé de touffes ou de bouclettes. Le velours ciselé comprend donc deux sortes de velours : le velours coupé, composé de touffes de poils, et le velours frisé ou épinglé, composé de bouclettes de poil. Un velours ciselé est uniquement confectionné au moyen d'un métier à bras car les touffes de poil et les bouclettes sont exécutées à la main au moyen d'un rabot et de fers. "
457,Terciopelo cortado,457,Velours coupé,armure,"Velours, uni ou façonné, dont la surface est constituée par les fils d'une ou plusieurs chaînes poil dressées au-dessus d'une armure de fond et sectionnés à la même hauteur","Loc. masc. Part. passé de couper. Pour le velours coupé, la chaîne toile peut travailler d'après plusieurs genres d'armures telles que le taffetas, le gros de Tours, le sergé ... La deuxième chaîne produit le velours. Le fer est formé d'une tige de laiton qui possède une rainure transversale à la partie supérieure. Le fer coupé, enveloppé par la chaîne de poil est délivré en coupant les fils avec un rasoir, appelé pince qui, monté sur un outil appelé rabot, glisse dans la rainure du fer et partage le poil exactement au milieu de son développement.","Bezon, Jean. Dictionnaire général des tissus anciens et modernes.‎ Tome 2.‎ Lyon : Th . Lepagnez, 1859, p. 72 ; CIETA, Guelton, Marie-Hélène et Valansot, Odile (dir.). Vocabulaire technique français Lyon: Centre international d’étude des textiles anciens, 2020, p. 53 ;  Pariset, Ernest. Les industries de la soie, sériciculture, filature, moulinage, tissage, teinture. Histoire et statistique, Lyon: Pitrat aîné, 1862, p. 261 ; Villard, Claude. Manuel de théorie du tissage. Tome I. Lyon: A. Rey, 1948, p. 214-220",,,,,,,,,,,,,,,,"468--Trame de fond--Loc. masc. Part. passé de couper. Pour le velours coupé, la chaîne toile peut travailler d'après plusieurs genres d'armures telles que le taffetas, le gros de Tours, le sergé ... La deuxième chaîne produit le velours. Le fer est formé d'une tige de laiton qui possède une rainure transversale à la partie supérieure. Le fer coupé, enveloppé par la chaîne de poil est délivré en coupant les fils avec un rasoir, appelé pince qui, monté sur un outil appelé rabot, glisse dans la rainure du fer et partage le poil exactement au milieu de son développement."
458,Terciopelo de dos o más altos,458,Velours relevé,,"Velours façonné, formé par une ou plusieurs chaînes poil et produisant plusieurs hauteurs de velours frisé ou coupé",Loc. masc. Part. passé de relever. Velours façonné qui présente plusieurs hauteurs de poils de velours frisé et coupé.,"CIETA. Vocabulaire français. Lyon: Centre  International d’Etude des Textiles Anciens, 1997 ; Marie F. Viallon, Paraître et se vêtir au XVIe siècle: actes du XIIIe Colloque du Puy-en-Velay, Université de Saint-Etienne, 2006 ; Dictionnaire de l'Académie française, https://www.dictionnaire-academie.fr/article/A9R1484.",,,,,,,,,,,,,,,,469--Trame de bourré--Loc. masc. Part. passé de relever. Velours façonné qui présente plusieurs hauteurs de poils de velours frisé et coupé.
460,Terciopelo gofrado,460,Velours gaufré,,,Loc. masc. Part. passé de gaufrer. Utilisé en anglais pour désigner un velours à motifs en relief,"Elisabeth Hardouin-Fugier et al., Les étoffes : dictionnaire historique, Paris : Les éditions de l'Amateur, 2005 ; Dictionnaire de l'Académie française, https://www.dictionnaire-academie.fr/article/A9G0357.",,,,,,,,,,,,,,,,470--Trame lancée--Loc. masc. Part. passé de gaufrer. Utilisé en anglais pour désigner un velours à motifs en relief
459,Terciopelo labrado,459,Velours façonné,,,"Loc. masc. Part. passé de façonner. Un velours façonné présente un fond et un décor. Le montage au métier requiert donc d'utiliser un système supplémentaire pour le dessin, en plus de l'armure de fond.","Marie F. Viallon, Paraître et se vêtir au XVIe siècle: actes du XIIIe Colloque du Puy-en-Velay, Université de Saint-Etienne, 2006 ; Dictionnaire de l'Académie française, https://www.dictionnaire-academie.fr/article/A9F0042.",,,,,,,,,,,,,,,,"471--Trame brochée--Loc. masc. Part. passé de façonner. Un velours façonné présente un fond et un décor. Le montage au métier requiert donc d'utiliser un système supplémentaire pour le dessin, en plus de l'armure de fond."
,,,,,,,,,,,,,,,,,,,,,,,472--Trame supplémentaire--
