ID-ES,TERM-ES,,ID,TÉRMINO,Qualifier,DEFINICIÓN INICIAL,DEFINICIÓN FINAL,FUENTES ,SINÓNIMOS,OBSERVACIONES,,,,,,,,,,,,,,
310,Lanzado,,310,Lanciato,,,"agg. E' così chiamatp l'effetto di disegno formato da trame supplementeri che vanno da una cimosa all'altra in un tessuto di seta, cotone o raion e non partecipano alla formazione del fondo della stoffa. Queste trame formano al diritto gli effetti di disegno, al rovescio restano legate dall'ordito di fondo o da un ordito di legatura. E' traduzione della voce fr. lancé. Vedi spolinato","ANIELLO GENTILE, Dizionario etimologico dell'arte tessile, Napoli, 1981.",,,,,,,,,,,,,,,,
,,,,,,,,,,,,,,,,,,,,,,,,----
313,Lazo,,313,Laccio,,,"L’insieme degli anelli dentro i quali sono riunite le corde del
ramo o del tiratoio che devono essere tirate per sollevare i fili
dell’ordito nel telaio al tiro. Un errore nella programmazione
della confezione dei lacci o nel tirarli determina un ‘errore del
tiro’.",CIETA Vocabolario Tecnico,,,,,,,,,,,,,,,,"313--Laccio--L’insieme degli anelli dentro i quali sono riunite le corde del
ramo o del tiratoio che devono essere tirate per sollevare i fili
dell’ordito nel telaio al tiro. Un errore nella programmazione
della confezione dei lacci o nel tirarli determina un ‘errore del
tiro’."
317,Ligadura,,317,Legatura,,,s.f. Nella tecnica della tessitura è l'intreccio di un filo dell'ordito con uno della trama.,"ANIELLO GENTILE, Dizionario etimologico dell'arte tessile, Napoli, 1981.",,,,,,,,,,,,,,,,317--Legatura--s.f. Nella tecnica della tessitura è l'intreccio di un filo dell'ordito con uno della trama.
314,Ligamento por trama,,314,Armatura per trama,,,"Armatura in cui le trame prevalgono sull’ordito,
nascondendolo in tutto o in parte.",CIETA Vocabolario Tecnico,,,,,,,,,,,,,,,,"314--Armatura per trama--Armatura in cui le trame prevalgono sull’ordito,
nascondendolo in tutto o in parte."
315,Ligamento por urdimbre,,315,Armatura per ordito,,,"Armatura in cui i fili di ordito predominano sulla superficie del
tessuto, nascondendo in tutto o in parte le trame.",CIETA Vocabolario Tecnico,,,,,,,,,,,,,,,,"315--Armatura per ordito--Armatura in cui i fili di ordito predominano sulla superficie del
tessuto, nascondendo in tutto o in parte le trame."
318,Ligamento,,318,Armatura,,,"Sistema in cui si intrecciano i fili di ordito e di trama secondo
uno schema predefinito. Un tessuto può avere una o più
armature diverse.",CIETA Vocabolario Tecnico,,,,,,,,,,,,,,,,"318--Armatura--Sistema in cui si intrecciano i fili di ordito e di trama secondo
uno schema predefinito. Un tessuto può avere una o più
armature diverse."
319,Lineta,,319,Gruppo Licci di alzata,,,"Licci le cui maglie operano esclusivamente per
sollevare i fili di ordito.",CIETA Vocabolario Tecnico,,,,,,,,,,,,,,,,"319--Gruppo Licci di alzata--Licci le cui maglie operano esclusivamente per
sollevare i fili di ordito."
282,Lisaje,,282,Lettura,,,"Selezione effettuata al telaio al tiro sulle corde del
ramo o del tiratoio per preparare la confezione dei
lacci. Gli errori di lettura avvengono soprattutto per
l’omissione di corde o per uno sbaglio nella loro
selezione. Provocano sul tessuto un disegno
spezzato o una scalinatura maggiore nei contorni.",CIETA Vocabolario Tecnico,,,,,,,,,,,,,,,,
321,Liso,,321,Unito,,,"1. Aspetto uniforme di un tessuto.
2. Per estensione, un tessuto in cui l’armatura si
ripete regolarmente senza interruzioni o
cambiamenti sulla superficie, prodotta soltanto con i
licci.",CIETA Vocabolario Tecnico,Liscio,,,,,,,,,,,,,,,"321--Unito--1. Aspetto uniforme di un tessuto.
2. Per estensione, un tessuto in cui l’armatura si
ripete regolarmente senza interruzioni o
cambiamenti sulla superficie, prodotta soltanto con i
licci."
322,Listado,,322,Rigato,,,"Si dice di un tessuto che presenta effetti decorativi di
colore differente nel senso dell’ordito, dovuti alle
note di orditura. Da non confondere con il pékin, che
può essere anche rigato.",CIETA Vocabolario Tecnico,,,,,,,,,,,,,,,,"322--Rigato--Si dice di un tessuto che presenta effetti decorativi di
colore differente nel senso dell’ordito, dovuti alle
note di orditura. Da non confondere con il pékin, che
può essere anche rigato."
324,Lizo,,324,Liccio,,,"s.m. Elemento del telaio per tessitura che ha la funzione di sollevare i fili dell'ordito per formare la bocca entro cui far passare la navetta che porta il filo di trama. É costituito da una robusta intelaiatura di legno o di metallo rettangolare entro cui sono disposti fili ritorti o numerosi collegamenti sottili, di solito di acciaio a filo o a lamina, con un occhiello centrale entro il quale passa un filo dell'ordito. Per ogni telaio non sono previsti piu di due licci. Lat. licium","ANIELLO GENTILE, Dizionario etimologico dell'arte tessile, Napoli, 1981.",,,,,,,,,,,,,,,,"324--Liccio--s.m. Elemento del telaio per tessitura che ha la funzione di sollevare i fili dell'ordito per formare la bocca entro cui far passare la navetta che porta il filo di trama. É costituito da una robusta intelaiatura di legno o di metallo rettangolare entro cui sono disposti fili ritorti o numerosi collegamenti sottili, di solito di acciaio a filo o a lamina, con un occhiello centrale entro il quale passa un filo dell'ordito. Per ogni telaio non sono previsti piu di due licci. Lat. licium"
323,Lizo de alza,,323,Liccio di alzata,,,"Liccio le cui maglie operano esclusivamente per
sollevare i fili di ordito.",CIETA Vocabolario Tecnico,,,,,,,,,,,,,,,,"323--Liccio di alzata--Liccio le cui maglie operano esclusivamente per
sollevare i fili di ordito."
325,Lizo de rebaten ,,325,Liccio di abbassata,,,"Licci le cui maglie operano esclusivamente per
abbassare i fili dell’ordito.",CIETA Vocabolario Tecnico,,,,,,,,,,,,,,,,"325--Liccio di abbassata--Licci le cui maglie operano esclusivamente per
abbassare i fili dell’ordito."
425,Luisina,,425,Louisine,,,"Taffetas i cui fili di ordito lavorano a gruppi di due o
più con un solo colpo di trama. Ogni filo è rimesso
individualmente nelle maglie dei licci, in modo da
rimanere perfettamente parallelo e non sovrapporsi
a quelli vicini. Nella definizione si deve specificare il
numero di fili, es: lousine di due fili.",CIETA Vocabolario Tecnico,,,,,,,,,,,,,,,,"425--Louisine--Taffetas i cui fili di ordito lavorano a gruppi di due o
più con un solo colpo di trama. Ogni filo è rimesso
individualmente nelle maglie dei licci, in modo da
rimanere perfettamente parallelo e non sovrapporsi
a quelli vicini. Nella definizione si deve specificare il
numero di fili, es: lousine di due fili."
326,Luquesa,,326,Lucchese,,"Tessuto di seta che imita quello prodotto a Lucca (Italia), il cui ordito è di seta fine, bollito e puro, senza unirlo ad altro tinto e puro o tinto crudo",,,,,,,,,,,,,,,,,,326--Lucchese--
,,,,,,,,,,,,,,,,,,,,,,,,----
,,,,,,,,,,,,,,,,,,,,,,,,
330,Lustrina brochada,,,,,,,,,,,,,,,,,,,,,,,----
329,Lustrina de seda,,,,,,,,,,,,,,,,,,,,,,,----
,,,,,,,,,,,,,,,,,,,,,,,,----
426,Madeja de seda,,426,Matassa di seta,,,"s.f. Quantità di filato tessile avvolto a spire su un supporto di solito girevole (aspo o guindolo) e poi legato con il capo perchè non si arruffi. La matassatura puo essere a tipo incrociato, detto anche con azzettatura ' Grant', se il filo viene deposto obliquamente rispetto alla larghezza della fascia della matassa; del tipo a filzuoli o a fili paralleli se si dispongono sull'aspo le spire l'una accanto all'altra. Lat. mataxa, dal grec. mátaxa ' seta cruda', da cui il significato di fune, corda.","ANIELLO GENTILE, Dizionario etimologico dell'arte tessile, Napoli, 1981.",Mannella,,,,,,,,,,,,,,,"426--Matassa di seta--s.f. Quantità di filato tessile avvolto a spire su un supporto di solito girevole (aspo o guindolo) e poi legato con il capo perchè non si arruffi. La matassatura puo essere a tipo incrociato, detto anche con azzettatura ' Grant', se il filo viene deposto obliquamente rispetto alla larghezza della fascia della matassa; del tipo a filzuoli o a fili paralleli se si dispongono sull'aspo le spire l'una accanto all'altra. Lat. mataxa, dal grec. mátaxa ' seta cruda', da cui il significato di fune, corda."
427,Malla,,427,Maglia,,"Di fr. Maille. Due occhielli a corda con o senza maniglia che integrano un liccio o che sono sospesi alla fine di un arco e attraverso i quali passa un filo di ordito. Il peso chiamato ""piombo"" è sospeso nella parte posteriore. Attualmente sono in metallo.",,,,,,,,,,,,,,,,,,427--Maglia--
428,Mallón,,428,Maglione,,Anello di vetro o metallo posizionato tra i due occhielli che formano la maglia e attraverso il quale passa il filo di ordito o altri fili.,"1. Anello di vetro o di metallo sospeso all’estremità
di un’arcata per ricevere uno o più fili di ordito.
2. Per estensione, insieme costituito dalle maglie
fissate ai maglioni e dai piombini che le tengono in
tensione.",CIETA Vocabolario tecnico,,,,,,,,,,,,,,,,"428--Maglione--1. Anello di vetro o di metallo sospeso all’estremità
di un’arcata per ricevere uno o più fili di ordito.
2. Per estensione, insieme costituito dalle maglie
fissate ai maglioni e dai piombini che le tengono in
tensione."
335,Marabú,,335,Marabout,,,"Tessuto di seta molto fine, simile alla mussola ma di qualità inferiore, utilizzato per abiti da donna. Chiffon con trama e ordito di organzino, opaco o lucido, colorato e con intreccio taffetas.",,,,,,,,,,,,,,,,,"335--Marabout--Tessuto di seta molto fine, simile alla mussola ma di qualità inferiore, utilizzato per abiti da donna. Chiffon con trama e ordito di organzino, opaco o lucido, colorato e con intreccio taffetas."
342,Marca,,342,Marca,,"Misura certa e sicura. Per estensione, venivano chiamati tessuti di marca quelli che avevano una larghezza specifica in conformità con le ordinanze.",,,,,,,,,,,,,,,,,,342--Marca--
,,,,,,,,,,,,,,,,,,,,,,,,----
429,Marco ,,429,Quadro,,Supporto del gruppo di maglie che costituiscono un liccio.,"Supporto rigido in legno o metallo delle maglie che
compongono il liccio.",CIETA Vocabolario tecnico,,,,,,,,,,,,,,,,"429--Quadro--Supporto rigido in legno o metallo delle maglie che
compongono il liccio."
341,Marlí,,341,Marlí,,,"
Chiffon leggero o tulle di pizzo, realizzato con filo o seta cinese, molto diffuso nel XVIII secolo. Il grande marlí era fabbricato in seta nera grezza e con la trama del filo di Bretagna.",,,,,,,,,,,,,,,,,"341--Marlí--
Chiffon leggero o tulle di pizzo, realizzato con filo o seta cinese, molto diffuso nel XVIII secolo. Il grande marlí era fabbricato in seta nera grezza e con la trama del filo di Bretagna."
337,Marquiseta,,337,Marchesetta,,,"s.f. Tessuto leggero, forte e trasparente, usato per tende. Adattamento del fr. marquisette, dim. di marquise.","ANIELLO GENTILE, Dizionario etimologico dell'arte tessile, Napoli, 1981.",,,,,,,,,,,,,,,,"337--Marchesetta--s.f. Tessuto leggero, forte e trasparente, usato per tende. Adattamento del fr. marquisette, dim. di marquise."
338,Matizado,,338,Sfumato,tessuto,,Tela con tecnica di sfumato realizzato con seta di diverso colore,,,,,,,,,,,,,,,,,338--Sfumato--Tela con tecnica di sfumato realizzato con seta di diverso colore
476,Matizado,,476,Sfumato,processo,,Tecnica di sfumato realizzata con seta di diverso colore o utilizzando bagno di tinte fino a raggiungere la gradazione desiderata.,,,,,,,,,,,,,,,,,
340,Media seda,,340,Mezza seta,,"Termine che identifica i tessuti con ordito di seta e trama di qualsiasi altra fibra, o con trama di seta e ordito di qualsiasi altra fibra.",,,,,,,,,,,,,,,,,,340--Mezza seta--
430,Mejicana,,430,Messicana ,,,"Tessuto operato a più peli striscianti, della famiglia
dei pékin.",CIETA Vocabolario tecnico,,,,,,,,,,,,,,,,"430--Messicana --Tessuto operato a più peli striscianti, della famiglia
dei pékin."
344,Menador,,,,,,,,,,,,,,,,,,,,,,,----
345,Menar,,,,,,,,,,,,,,,,,,,,,,,----
348,Molinar,,348,Torcere,,,"All’origine il termine indicava l’insieme delle
operazioni aventi lo scopo di torcere i fili di seta; in
seguito anche fili di altra natura.",CIETA Vocabolario tecnico,,,,,,,,,,,,,,,,"348--Torcere--All’origine il termine indicava l’insieme delle
operazioni aventi lo scopo di torcere i fili di seta; in
seguito anche fili di altra natura."
431,Montura,,431,Montatura,,,"1. L’organizzazione dei maglioni e dei licci sul
telaio.
2. Il piano di programmazione dei fili di ordito.",CIETA Vocabolario tecnico,,,,,,,,,,,,,,,,"431--Montatura--1. L’organizzazione dei maglioni e dei licci sul
telaio.
2. Il piano di programmazione dei fili di ordito."
433,Montura a la Jacquard,,,Montaggio alla Jaquard,,,,,,,,,,,,,,,,,,,,--Montaggio alla Jaquard--
432,Montura a lizos,,,,,,,,,,,,,,,,,,,,,,,----
434,Montura mixta,,,,,,,,,,,,,,,,,,,,,,,----
346,Muaré,,346,Marezzato,tecnica,,"Effetti di riflessione di luce che si ottengono pressando con movimento rotatorio, dopo la piegatura, armature a coste trasversali. P.p. di marezzare, denom. da mare, 'per dipingere a forma di onde marine', col suff. -ezzare di origine settentrionale, per -eggiare.","ANIELLO GENTILE, Dizionario etimologico dell'arte tessile, Napoli, 1981.",,,,,,,,,,,,,,,,"346--Marezzato--Effetti di riflessione di luce che si ottengono pressando con movimento rotatorio, dopo la piegatura, armature a coste trasversali. P.p. di marezzare, denom. da mare, 'per dipingere a forma di onde marine', col suff. -ezzare di origine settentrionale, per -eggiare."
347,Muaré,,347,Marezzato,tessuto,," s.m. Leggera stoffa di seta dai riflessi cangianti e ondulati, ottenuti sottoponendo il tessuto alla pressione di una calandra; tessuto di lana di caratteristica brillantezza, marezzata; lana mohair. ","ANIELLO GENTILE, Dizionario etimologico dell'arte tessile, Napoli, 1981.","Amoerro, amuèrre, moèrro",,,,,,,,,,,,,,,"347--Marezzato-- s.m. Leggera stoffa di seta dai riflessi cangianti e ondulati, ottenuti sottoponendo il tessuto alla pressione di una calandra; tessuto di lana di caratteristica brillantezza, marezzata; lana mohair. "
354,Musco ,,354,Musco,,,Der. Spagn. color marrone scuro,,,,,,,,,,,,,,,,,354--Musco--Der. Spagn. color marrone scuro
355,Muselina,,355,Mussolina,,,"s.f. Tipo di tessuto morbido e leggerissimo, in tela di cotone, lana o seta, formato da filati fini sia in ordito che in trama, importato in Inghilterra nel XVII sec. dal Medio Oriente. Detto anche mosal. Lat. mediev. musolum. Dall'ar. Mossul, nome della famosa città della Mesopotamia. Dall'it. tela mussolina, il fr. mousseline; fr. a. mosulin (XIII sec.) forse dal veneziano; anche l'ingl. mussolin (muslin, 1609) è accatto dall'italiano.","ANIELLO GENTILE, Dizionario etimologico dell'arte tessile, Napoli, 1981.",,,,,,,,,,,,,,,,"355--Mussolina--s.f. Tipo di tessuto morbido e leggerissimo, in tela di cotone, lana o seta, formato da filati fini sia in ordito che in trama, importato in Inghilterra nel XVII sec. dal Medio Oriente. Detto anche mosal. Lat. mediev. musolum. Dall'ar. Mossul, nome della famosa città della Mesopotamia. Dall'it. tela mussolina, il fr. mousseline; fr. a. mosulin (XIII sec.) forse dal veneziano; anche l'ingl. mussolin (muslin, 1609) è accatto dall'italiano."
,,,,,,,,,,,,,,,,,,,,,,,,----
357,Orillo,,357,Cimosa,,,"s.f. Margine laterale dei tessuti in pezza, di ordito più fitto e di tensione uguale al tessuto di fondo. le cimose dei tessuti antichi (XIII e XIV sec.) erano costituite da uno o due grossi fili di canapa o lino, detti cordelloni. Dal lat. tardo cimussa, di incerta etimologia.","ANIELLO GENTILE, Dizionario etimologico dell'arte tessile, Napoli, 1981.",Vivagno,,,,,,,,,,,,,,,"357--Cimosa--s.f. Margine laterale dei tessuti in pezza, di ordito più fitto e di tensione uguale al tessuto di fondo. le cimose dei tessuti antichi (XIII e XIV sec.) erano costituite da uno o due grossi fili di canapa o lino, detti cordelloni. Dal lat. tardo cimussa, di incerta etimologia."
358,Ormesí,,358,Ormesí,,"Tessuto il cui nome deriva dalla città di Ormuz in Iran. Tessuto di seta forte molto denso o pressato, con diversi toni o ha una decorazione ad acqua.",,,,,,,,,,,,,,,,,,358--Ormesí--
435,Otomán,,435,Ottoman,,"s.f. ant. tipo di tessuto ad armatura di tela o derivata dalla tela a coste orizzontali molto marcate e distanziate, dette cannette. Dall'ar. othman, sostantivo ( agg. othmānī). Faille francese con coste irregolari molto rilevate.","s.f. ant. tipo di tessuto ad armatura di tela o derivata dalla tela a coste orizzontali molto marcate e distanziate, dette cannette. Dall'ar. othman, sostantivo ( agg. othmānī). Faille francese con coste irregolari molto rilevate.",CIETA Vocabolario tecnico,Ottomana,,,,,,,,,,,,,,,"435--Ottoman--s.f. ant. tipo di tessuto ad armatura di tela o derivata dalla tela a coste orizzontali molto marcate e distanziate, dette cannette. Dall'ar. othman, sostantivo ( agg. othmānī). Faille francese con coste irregolari molto rilevate."
436,Pasada,,436,Passata,,,"Passaggio completo di tutte le trame che, in rigoroso
ordine di successione, si alternano per formare gli
effetti di disegno.
La passata costituisce generalmente una
scalinatura di trama nei tessuti operati.
L’espressione ‘per passata’ aggiunta al nome di
un’armatura indica che tutte le trame della passata
lavorano insieme in questa armatura come se
fossero un elemento unico. Es: un taffetas per
passata.",CIETA Vocabolario tecnico,,,,,,,,,,,,,,,,"436--Passata--Passaggio completo di tutte le trame che, in rigoroso
ordine di successione, si alternano per formare gli
effetti di disegno.
La passata costituisce generalmente una
scalinatura di trama nei tessuti operati.
L’espressione ‘per passata’ aggiunta al nome di
un’armatura indica che tutte le trame della passata
lavorano insieme in questa armatura come se
fossero un elemento unico. Es: un taffetas per
passata."
359,Peine,,359,Pettine,,,"s.m. Nella tecnica della tessitura è quel dispositivo costituito da sottili lamine metalliche parallele, fissate da due traverse orizzontali, attraverso le quali passano i fili dell'ordito. Il numero delle lamine è in rapporto col tipo di tessuto. Collocato sulla cassa battente serve a ravvicinare i fili di trama al tessuto già fatto. Dal lat. pecten, -inis 'pettine.","ANIELLO GENTILE, Dizionario etimologico dell'arte tessile, Napoli, 1981.",,,,,,,,,,,,,,,,"359--Pettine--s.m. Nella tecnica della tessitura è quel dispositivo costituito da sottili lamine metalliche parallele, fissate da due traverse orizzontali, attraverso le quali passano i fili dell'ordito. Il numero delle lamine è in rapporto col tipo di tessuto. Collocato sulla cassa battente serve a ravvicinare i fili di trama al tessuto già fatto. Dal lat. pecten, -inis 'pettine."
437,Pelillo,,437,Pelillo,,ordito di legatura,,CIETA Vocabolario tecnico,,,,,,,,,,,,,,,,437--Pelillo--
360,Pelo,,360,pelo,filo,Filo di seta attorcigliato su se stesso. Parte pelosa di un tessuto.,"1. Filo di seta greggia estratto dal bozzolo, ritorto su
se stesso, soprattutto a Z. La torsione varia a
seconda dell’utilizzazione finale del filo lavorato.
.",CIETA Vocabolario tecnico,,,,,,,,,,,,,,,,"360--pelo--1. Filo di seta greggia estratto dal bozzolo, ritorto su
se stesso, soprattutto a Z. La torsione varia a
seconda dell’utilizzazione finale del filo lavorato.
."
438,Pelo,,438,pelo,attributo,Parte pelosa di un tessuto,"Nome dato all’ordito supplementare con funzione
decorativa. Vd. Ordito di pelo, Pelo strisciante.
 Parte vellutata di un tessuto",CIETA Vocabolario tecnico,,,,,,,,,,,,,,,,"438--pelo--Nome dato all’ordito supplementare con funzione
decorativa. Vd. Ordito di pelo, Pelo strisciante.
 Parte vellutata di un tessuto"
439,Peluche,,439,Peluche,,,"s.f. Stoffa solitamente di lana, dal pelo più lungo del velluto, morbido e folto, usata per cappotti e cappelli e nella fabbricazione di giocattoli e soprammobili; tessuto felpato; velluto riccio. Voce fr. derivata dall'it. peluzzo. Dalla Francia passata all'inglese plush (XVII sec.) allo sp. peluche e anche al ted. Plüsch al russo plus. in it. e sp. accanto al francese peluche è usato felpa.","ANIELLO GENTILE, Dizionario etimologico dell'arte tessile, Napoli, 1981.",,,,,,,,,,,,,,,,"439--Peluche--s.f. Stoffa solitamente di lana, dal pelo più lungo del velluto, morbido e folto, usata per cappotti e cappelli e nella fabbricazione di giocattoli e soprammobili; tessuto felpato; velluto riccio. Voce fr. derivata dall'it. peluzzo. Dalla Francia passata all'inglese plush (XVII sec.) allo sp. peluche e anche al ted. Plüsch al russo plus. in it. e sp. accanto al francese peluche è usato felpa."
361,Pequín,,361,Pechino,,,"s.m. Tipo di seta a bande lucide che si alternano a bande matte, in senso longitudinale, ottenuto con armatura fantasia. Dal fr. pékin 'stoffa di seta' attestato nel XVI sec., dal nome della città di Pechino (Peking, già Pei'ping) portato in Europa dai missionari, nella forma Pekin. Il francese ha anche i derivati pékinade 'stoffa cinese per arredamento' e pékiné ' stoffa a bande' come il pékin.","ANIELLO GENTILE, Dizionario etimologico dell'arte tessile, Napoli, 1981.",,,,,,,,,,,,,,,,"361--Pechino--s.m. Tipo di seta a bande lucide che si alternano a bande matte, in senso longitudinale, ottenuto con armatura fantasia. Dal fr. pékin 'stoffa di seta' attestato nel XVI sec., dal nome della città di Pechino (Peking, già Pei'ping) portato in Europa dai missionari, nella forma Pekin. Il francese ha anche i derivati pékinade 'stoffa cinese per arredamento' e pékiné ' stoffa a bande' come il pékin."
440,Ligamento pesado,,440,Armatura pesante,,Termine utilizzato per descrivere un'armatura tessuta tendendo al massimo il filo o il liccio per quella determinata armatura,,,,,,,,,,,,,,,,,,440--Armatura pesante--
362,Piñuela,,,Pigna,,,Nome spagnolo per tessuto,,,,,,,,,,,,,,,,,--Pigna--Nome spagnolo per tessuto
363,Plegador,,363,Subbio,,,"s.m. Cilindro generalmente di legno, sul quale, nel telaio, si avvolgono i fili dell'ordito o il tessuto che si viene formando nella tessitura. Quello sul quale si avvolge il tessuto è disposto nella parte anteriore dove è l'operaio e un sistema regolatore a peso ne permette una rotazione lenta e uniforme. Lat. tardo insubulum ' pernio del telaio'.","ANIELLO GENTILE, Dizionario etimologico dell'arte tessile, Napoli, 1981.",,,,,,,,,,,,,,,,"363--Subbio--s.m. Cilindro generalmente di legno, sul quale, nel telaio, si avvolgono i fili dell'ordito o il tessuto che si viene formando nella tessitura. Quello sul quale si avvolge il tessuto è disposto nella parte anteriore dove è l'operaio e un sistema regolatore a peso ne permette una rotazione lenta e uniforme. Lat. tardo insubulum ' pernio del telaio'."
441,Puesta en carta,,441,Messa in carta,,,"Metodo di rappresentazione grafica dell'intreccio che utilizza una trasposizione grafica quadrettata nella quale l'ordito è costituito dalle interlinee verticali, mentre le orizzontali segnano i passaggi (colpi) di trama. Viene perciò indicata la posizione che i vari licci (occorrenti ad ottenere una determinata armatura), devono assumere al passaggio delle trame. L'insieme rappresenta il tessuto. I cartoni si disegnano a destra dell'intreccio seguendo alcune convenzioni. Il quadretto annerito, che si trova nell'intersezione dei due elementi di ordito e di trama interessati, raffigura l'alzata di un filo d'ordito passante sopra la trama. Il rimettaggio lo si delinea nello stesso modo: l'interlinea verticale (che rappresenta il filo), è prolungata verso l'alto fino all'interlinea orizzontale che raffigura il liccio sul quale è passato. Un quadretto nero all'inserzione dei fili e del liccio, indica la maglia in cui il filo è messo. Messa in carta alla Lionese - Le linee verticali rappresentano i fili di ordito, le orizzontali le trame. L'alzata di un filo di ordito è segnata con un punto annerito posto nell'intersezione dei due elementi interessati.","MARIELLA AZZALI, Dizionario di costume e moda, dal filo all'abito, Roma, 2015.",,,,,,,,,,,,,,,,"441--Messa in carta--Metodo di rappresentazione grafica dell'intreccio che utilizza una trasposizione grafica quadrettata nella quale l'ordito è costituito dalle interlinee verticali, mentre le orizzontali segnano i passaggi (colpi) di trama. Viene perciò indicata la posizione che i vari licci (occorrenti ad ottenere una determinata armatura), devono assumere al passaggio delle trame. L'insieme rappresenta il tessuto. I cartoni si disegnano a destra dell'intreccio seguendo alcune convenzioni. Il quadretto annerito, che si trova nell'intersezione dei due elementi di ordito e di trama interessati, raffigura l'alzata di un filo d'ordito passante sopra la trama. Il rimettaggio lo si delinea nello stesso modo: l'interlinea verticale (che rappresenta il filo), è prolungata verso l'alto fino all'interlinea orizzontale che raffigura il liccio sul quale è passato. Un quadretto nero all'inserzione dei fili e del liccio, indica la maglia in cui il filo è messo. Messa in carta alla Lionese - Le linee verticali rappresentano i fili di ordito, le orizzontali le trame. L'alzata di un filo di ordito è segnata con un punto annerito posto nell'intersezione dei due elementi interessati."
364,Puntas,,364,Puntina,,,Orlo a punta del merletto. Tipo di passamaneria con orlo a punte.,"MARIELLA AZZALI, Dizionario di costume e moda, dal filo all'abito, Roma, 2015.",Dentello,,,,,,,,,,,,,,,364--Puntina--Orlo a punta del merletto. Tipo di passamaneria con orlo a punte.
,,,,,,,,,,,,,,,,,,,,,,,,----
442,Punto de ligadura,,442,Punto di legatura,,,"1. Punto in cui un filo di ordito passa sopra una
trama.
2. Legatura effettuata su una briglia di trama o di
ordito per interromperne la lunghezza.",CIETA Vocabolario tecnico,,,,,,,,,,,,,,,,"442--Punto di legatura--1. Punto in cui un filo di ordito passa sopra una
trama.
2. Legatura effettuata su una briglia di trama o di
ordito per interromperne la lunghezza."
365,Punzó,,365,Rosso papavero,,,Color rosso vivace,,,,,,,,,,,,,,,,,365--Rosso papavero--Color rosso vivace
